name,original_price,special_price,specification,description,original_fragrance,top_notes,middle_notes,base_notes,detail_url,gender,fragrance,brand,ml,discount_rate,price_per_ml
Perry Ellis 360°度女性淡香水,2150.0,1450.0,100ml,盲买的一款香水，被200ml的大容量吸引，到手后果然是好大一支。一开始会有浓浓的荔枝果冻味，随后是纯粹的花香味，完全没有一点甜味，适合35岁以上的女性。个人觉得也蛮适合运动前使用，可以让中和汗臭味,水生花香调,百合、甜瓜、桂花、玫瑰、蜜橘,薰衣草、睡莲、鼠尾草、铃兰,檀木、琥珀、麝香、香草、香根草,https://www.1976.com.tw/prod/2964,female,花香调,Perry Ellis,100.0,32.56,14.5
Workshop Tea Rose 茶玫瑰女性淡香水,2380.0,1180.0,100ml,真的是满满的玫瑰香气，香气浓郁，可以持续一整天，因为容易流汗，通常我都选择香味较持久的香精购买，想不到这瓶香水的香味比任何香精都还持久，玫瑰的香气与我另一瓶Jo Malone red roses cologne的香味好像，甚至香气还更持久，真的是便宜的好物,玫瑰花香调,牡丹、洋甘菊,茶玫瑰、锦缎玫瑰、保加利亚玫瑰,天竺葵叶、紫罗兰叶、雪松,https://www.1976.com.tw/prod/18543,female,花香调,Workshop Tea Rose,100.0,50.42,11.8
Roberto Cavalli Paradiso 天堂女性淡香精,3500.0,1550.0,75ml,如其名，其柑橘与花香如置身热带阳光沙滩，然香味却浓。与VERSACE 浮华淡香精有些许雷同，但比较浓厚些，VERSACE反优雅。,木质花香调,柑橘、佛手柑,茉莉,松树、柏树、月桂叶,https://www.1976.com.tw/prod/15394,female,木质调,Roberto Cavalli Paradiso,75.0,55.71,20.67
Missoni 幻镜之水女性淡香精,3500.0,1450.0,100ml 白盒,"这和chloe同名很像几乎一样,会对chloe同名晕香的人,可选用这支,持久度还不错,睡前喷到隔天早上都还闻的到",柑橘花香调,柠檬、佛手柑、雪松、蜜糖苹果、西洋梨,浅粉玫瑰、印度茉莉,龙涎香、零陵香豆、檀香,https://www.1976.com.tw/prod/16195,female,柑橘调,Missoni,100.0,58.57,14.5
JLo Live Luxe 珍妮佛罗培兹珍爱安可女性淡香精,1980.0,999.0,100ml,这是我用了N瓶的香水，甜甜果香味真的让人闻起来一整天心情都会很好，瓶身很美很漂亮，买来自己用，像是自己送给自己最好的礼物～,花果甜美调,柑橘、苹果、甜瓜、西洋梨、桃子,铃兰花瓣、金银、鸢尾草,麝香、香草、檀木,https://www.1976.com.tw/prod/3587,female,果香调,,100.0,49.55,9.99
MCM Crush 粉漾背包女性淡香精,2240.0,1450.0,30ml,MCM CRUSH 粉漾背包女性淡香精，将瓶身换上活泼热情的粉红底色，衬托著黑色的Visetos老花图案，展现了青春动感的女性魅力。,木质花香调,冷冻梨、粉红胡椒、黑醋栗、杏花蜜,玉兰花、五月玫瑰、白牡丹,雪松、黄葵、喀什米尔木,https://www.1976.com.tw/prod/21858,female,木质调,,30.0,35.27,48.33
Jo Malone 英国梨与甜豌豆香水迷你瓶-English Pear & Sweet Pea,1200.0,750.0,9ml 喷式，无盒装,这支的味道像是清新版的Burberry My Burberry 女性淡香水，一样有甜豌豆，所以一闻就想起来另一只，味道很丰满冬天很适合，搭上了英国梨会比Burberry那支清爽很多，我会只喷耳后一下、带出一点味道就好，再搭其他的。,花果清新调,威廉梨,甜豌豆,白麝香,https://www.1976.com.tw/prod/21529,female,清新调,Jo Malone,9.0,37.5,83.33
Kilian Good Girl Gone Bad 狂野淑女淡香精行动香氛,1800.0,1360.0,7.5ml 喷式,白鹿、罗云熙推荐的香水，如少女般的纯情桂花与茉莉的花香，而中后调逐渐弥漫开来的是撩人且魅惑的晚香玉，从清纯转变到性感的反差香水！,花香调,桂花、橙花、五月玫瑰,晚香玉、茉莉、水仙花,琥珀、雪松,https://www.1976.com.tw/prod/23213,female,花香调,Kilian,7.5,24.44,181.33
Roberto Cavalli Paradiso Azzurro 蔚蓝天堂女性淡香精,3500.0,1550.0,75ml,第一次闻到试管小香的惊艳，让人心动仿佛吹著香甜的海风；怡然自得的舒适香调，会莫名的想一喷再喷，随时随地让香味不停的徘回在身上。,水生花香调,柑橘、佛手柑、薰衣草,茉莉、海洋调、苹果、桃子、玫瑰、晚香玉,柏树、喀什米尔木、琥珀木、檀木、香草,https://www.1976.com.tw/prod/15812,female,花香调,Roberto Cavalli Paradiso Azzurro,75.0,55.71,20.67
Kate Spade Bloom 桃气花语淡香水,1700.0,899.0,40ml,前调的苹果味蛮明显的，酸酸甜甜的，不会太过甜腻。一开始还有点觉得跟自己手边的光韵很像，但仔细闻，光韵的花香比较重，但桃气花语再夹杂著果香。穿一整天到后面蛮有伪体香的感觉，超级喜欢,木质花香调,玉青苹果、柠檬、甜橙,山茶花、橙花、伊兰伊兰,雪松、喀什米尔、檀香,https://www.1976.com.tw/prod/21655,female,木质调,Kate Spade,40.0,47.12,22.48
Perry Ellis Reserve 女性淡香精,2980.0,1650.0,100ml,在相互有好感的男女关系下，被赠与这瓶是第一次接触香水的开始～中间跑票过BVLGARI、KENZO、CHLOE，但还是钟爱这支！不是妳所想像那样普遍的檀香、小苍兰味蕾，而是一种森林系的小清新！,东方花香调,橡苔、荷花、金盏花、玫瑰,洋甘菊、紫罗兰、小苍兰,广藿香、檀香,https://www.1976.com.tw/prod/8093,female,花香调,Perry Ellis Reserve,100.0,44.63,16.5
Estee Lauder Youth Dew 青春之露女性淡香精,2600.0,1450.0,67ml,「青春之露」的味道和「鸦片」有点像，不过，少了几分冶艳、多了几分温馨。透过这样的香味，好像看见了冬天树林里的小木屋，里头铺设了厚实、温暖的地毯，壁炉里的火光荧荧，炉旁有个编织著毛线的慈爱母亲，空气里飘散著节庆一般的香料气息，虽然并不是那么精致细腻，仍是非常可人的。抹在身上，不自觉地也被这样的敦厚气氛感染，连行止间也稳重起来了......,东方花香调,橙、桃花、佛手柑、水仙、薰衣草,肉桂、决明子、兰花、茉莉、丁香、依兰、玫瑰、山谷百合、辛香,吐鲁香脂、秘鲁香脂、琥珀、广藿香、麝香、香草、橡苔、香根草、檀香,https://www.1976.com.tw/prod/10547,female,花香调,Estee Lauder Youth Dew,67.0,44.23,21.64
Sarah Jessica Parker NYC 莎拉洁西卡派克纽约时尚女性淡香精,3600.0,1500.0,内含淡香水100ml、香水笔10ml,味道真的很诱人喔~前味是浓郁水果软糖的酸甜，中味就渐渐转为清新的花香，最喜欢的后味残留在身上有温暖的感觉,花果甜美调,义大利佛手柑、野生红草莓、白桂花,大马士革、红玫瑰、栀子花、含羞草,柔润麝香、兰姆酒、香草,https://www.1976.com.tw/prod/14154,female,果香调,Sarah Jessica Parker,100.0,58.33,15.0
Tory Burch Cosmic Wood 晨曦茉莉淡香精,2650.0,2050.0,50ml,Tory Burch推出「梦境之粹香氛系列」，五款梦幻花香+复古经典瓶身，飘出阵阵仙气。,花香调,豆蔻、黄葵,茉莉花、鼠尾草,岩兰草,https://www.1976.com.tw/prod/21205,female,花香调,Tory Burch,50.0,22.64,41.0
Ariana Grande Thank U Next 谢谢下一位女性淡香精,3280.0,1680.0,100ml,莓果和椰子的味道很明显，有种坐在沙滩上晒著太阳，吃著覆盆子马卡龙，喝著一杯鲜榨椰子汁的夏日悠闲感！,诱人美食调,梨、覆盆子,粉红玫瑰、椰子,麝香、马卡龙,https://www.1976.com.tw/prod/18007,female,美食调,Ariana Grande Thank,100.0,48.78,16.8
Jo Malone 蓝风铃香水迷你瓶-Wild Bluebell,1200.0,699.0,9ml 喷式，无盒装,乍闻之下就是又甜又多汁的西瓜，甜但是清爽消暑，半点也不黏腻。仔细留心可以发现这股瓜味其实是几种花香混合出的假象，算是令人惊喜的拟态。,花香调,蓝风铃、丁香、橙花、柠檬,柿子、野蔷薇、茉莉、铃兰果香,白麝香、琥珀,https://www.1976.com.tw/prod/19659,female,花香调,Jo Malone,9.0,41.75,77.67
MFK L'eau A La Rose 玫瑰之水女性淡香水,7300.0,5480.0,70ml,MFK的爱恋玫瑰是我认为此生必定要收藏的玫瑰香水，没有之一，好穿百搭，是个清亮明丽的美人，买了试管，再买随身瓶，接下来想拥有的，就是35ml,玫瑰花香调,荔枝,保加利亚大马士革玫瑰、牡丹,麝香、千叶玫瑰,https://www.1976.com.tw/prod/17726,female,花香调,Maison Francis Kurkdjian,70.0,24.93,78.29
Jovan Musk for Women 麝香女性古龙水,750.0,499.0,96ml,这是支闻起来很温暖的香水，粉粉柔柔的味道，还很有质感，重点是味道淡雅但又超持久。,花香调,佛手柑,茉莉、橙花醇,麝香,https://www.1976.com.tw/prod/7465,female,花香调,Jovan Musk,96.0,33.47,5.2
Victoria's Secret Bombshell Seduction 重磅炸弹女性淡香精,2800.0,1850.0,50ml,,东方花香调,晚香玉,鼠尾草,麝香,https://www.1976.com.tw/prod/15968,female,花香调,Victoria,50.0,33.93,37.0
Sarah Jessica Parker Covet 莎拉洁西卡派克欲望拜金女淡香精,2500.0,1499.0,100ml 效期：2026.11,已经用了好几瓶，是我最爱的香水之一，香味很柔和，清新的味道，像被青草的气息环绕，一整天都是好心情，好几个朋友说味道很特别，很喜欢这个香味，问我是什么牌子，可惜停产了，所以多囤了几瓶，是会让人闻上瘾的迷人味道！,木质花香调,青草、西西里柠檬、巧克力,忍冬、木兰花,木质香、麝香、龙涎香,https://www.1976.com.tw/prod/4576,female,木质调,Sarah Jessica Parker Covet,100.0,40.04,14.99
Roberto Cavalli Paradiso Assoluto 绝对天堂女性淡香精,3500.0,1650.0,75ml,Paradiso Assoluto展现的是天堂般花园里的芳香，这是一款感性迷人的香气，以粉红胡椒和紫藤的花香和香辛气息开头。野茉莉的芳香，是Paradiso的灵魂，与红百合的芳香，和百香果的热情果香混合。香水的基调是感性而柔滑的，它由广藿香、檀木和香草构成。,东方花香调,粉红胡椒、紫藤、柠檬、葡萄柚,野茉莉、红百合、百香果,广藿香、檀木、香草、麝香,https://www.1976.com.tw/prod/16026,female,花香调,Roberto Cavalli Paradiso Assoluto,75.0,52.86,22.0
bebe 同名女性淡香精,2600.0,999.0,100ml 无缀饰,CP值很高，室内的话持香约五小时，喷上去有一种刚洗澡完的味道，很清香，喷了人家都误会是乳液香不是香水的香味，外型也很少女心，入手完全不后悔！,木质花香调,新鲜芒果、甜豌豆、夜来香,黑茉莉、玫瑰,檀香、麝香、黄金柏木,https://www.1976.com.tw/prod/8814,female,木质调,,100.0,61.58,9.99
Billie Eilish 怪奇比莉女性淡香精 TESTER,2480.0,1680.0,100ml 原厂环保纸盒包装，有瓶盖,很甜甜的美食调，巧克力的香味，喜欢美食调的人可以考虑这一支~闻起来很好吃像巧克力牛奶，难得在名人香水会有这种特别的美食调，也不会像糖果一样那种甜腻的感觉,诱人美食调,糖花瓣、柑橘、综合浆果,香草、香料、可可,木质调、麝香、零陵香豆,https://www.1976.com.tw/prod/22857,female,美食调,Billie Eilish,100.0,32.26,16.8
Jovan White Musk for Women 白麝香女性古龙水,600.0,580.0,96ml,很干净的皂粉感白麝香，记忆中熟悉的气味，虽是线性香调，却简洁耐闻。,花香调,依兰,茉莉、香水树,忍冬、白麝香、琥珀,https://www.1976.com.tw/prod/7937,female,花香调,Jovan White Musk,96.0,3.33,6.04
Jessica Simpson I Fancy You 渴望爱恋女性淡香精,3450.0,1350.0,100ml,虽然是清新调性的香水，但喷上她后，却有一种晒著冬日午后暖阳的慵懒错觉。很适合在冬天使用，它的味道能让你想起令人怀念的暖暖阳光。,花果清新调,水梨、富士苹果、佛手柑,夜来香、铃兰花瓣、风信子,檀香、粉红麝香、琥珀水晶,https://www.1976.com.tw/prod/9020,female,清新调,Jessica Simpson,100.0,60.87,13.5
Gres Cabotine 清秀佳人女性淡香水,2200.0,680.0,100ml,这是我的第一罐香水，当然已经用了好几罐了，我最喜欢睡觉时喷它，这样就会进入在草原采花的甜美梦境，早上在带著温暖的后味去上班，心情就一整个好。它有青青绿绿的香气还有温暖的花香，经典中的经典呀,花果清新调,菲律宾香水树、生姜,野姜百合、风信子、夜来香,麝香、果香,https://www.1976.com.tw/prod/2915,female,清新调,Gres Cabotine,100.0,69.09,6.8
Ariana Grande Thank U Next 2.0 谢谢下一位2.0女性淡香精,3280.0,2180.0,100ml,一喷下去就可以明显闻到草莓香! 是漂亮的花果香，不会是很人工不自然那种草莓软糖的味道，很甜美的香水！,诱人美食调,苹果汁、野草莓、石榴,兰花、茉莉,棉花糖、麝香、檀香,https://www.1976.com.tw/prod/21509,female,美食调,Ariana Grande Thank,100.0,33.54,21.8
Jo Malone 牡丹与胭红麂绒香水迷你瓶-Peony & blush suede,1200.0,680.0,9ml 喷式，无盒装,印象中jo malone香水的味道几乎偏苦涩有些甚至很难下手，而这罐的味道打破我对他们的标签，牡丹味道表现的非常明显，是一个可以用来单喷也可以混搭的香水,花香调,红苹果,牡丹花,麂绒,https://www.1976.com.tw/prod/20025,female,花香调,Jo Malone,9.0,43.33,75.56
Jovan Black Musk for Women 欲女黑麝香女性古龙水,500.0,499.0,96ml,与Jovan旗下的麝香古龙水相较之下，这只显然多了些”野放”氛围，欲女的名字有些虚张声势，反而比较像一本正经的粉领族上夜店，一改平日形象的性感，夜来香和焦糖交缠出不经意流露的诱惑，侵略性的麝香味紧追其后，算是独特的风格，还有一大重点：价格平易近人！值得一试！,木质花香调,甜桃、红石榴花蜜、巴西橙油,天鹅绒、夜来香、茉莉、苍兰,麝香、焦糖、弗吉尼亚雪松,https://www.1976.com.tw/prod/7463,female,木质调,Jovan Black Musk,96.0,0.2,5.2
Kate Spade Sparkle 桃气星空女性淡香精,3600.0,1490.0,100ml,整体的香味是果香+花香，黑醋栗的前味甜甜的，乍闻之下会是活泼年轻女孩的氛围，中间伴随花香跟雪松又是优雅气质的风格。持香度大概半天，是舒服可入眠的香味。推荐给约20多岁女孩。(来自香友社-Yu Lin Sun),诱人美食调,黑醋栗、粉红胡椒,紫牡丹、山楂,焦糖香草布蕾、雪松,https://www.1976.com.tw/prod/19985,female,美食调,Kate Spade,100.0,58.61,14.9
Alfred Sung Shi 水女性淡香精,2880.0,1380.0,100ml,从买了这一瓶香水后，被他的香水味深深吸引，也爱上开始买香水，但是至今还没找到可以取代他的香味，完全清澈干净的味道，没有粉味的果香，感觉是个呈现干净纯洁的女孩，身边所有的人都好喜欢，我应该会一直买下去...,水生花香调,无花果、睡莲,鸡蛋花、鲜橙,麝香、白桦木,https://www.1976.com.tw/prod/2497,female,花香调,Alfred Sung Shi,100.0,52.08,13.8
Cacharel Noa 珍珠女性淡香水,3800.0,1580.0,100ml,造型很漂亮，掌中明珠。味道像是拇指姑娘的味道，甜蜜可爱，温柔优雅，小巧依赖，想永远保护她，毕竟她是那么柔弱呀！,花果清新调,水蜜桃、李子、小苍兰,百合、茉莉、玫瑰、依兰,柏木、檀木、香子兰,https://www.1976.com.tw/prod/2542,female,清新调,Cacharel Noa,100.0,58.42,15.8
LANVIN Oxygene 浪凡悠氧女性淡香精,2950.0,1399.0,75ml,在福袋里面得到这款香氛，瓶子美的可以满足我这个外贸协会，而从瓶子喷出来的是副热带地区的公海的海水，海水冲充满生命力旺盛的海产，海水聚集后连海风也吹过来了，凉爽悠闲直沁心底，身体在工作，心里在度假，就是这个感觉。如要分析味道，应该是清凉的花香吧！香味虽淡却非常持久,水生花香调,天然树脂、胡荽、海索草,槴子花、蓝色鸢尾花、白檀木、麝香,白麝香、薄荷,https://www.1976.com.tw/prod/2749,female,花香调,Lanvin,75.0,52.58,18.65
Halloween 紫屋魔恋女性淡香水,1800.0,1550.0,100ml,瓶身像鸟笼的造型本身就很特别，香气调性可能是有青香蕉关系，前味刚开始闻到以为有甜芋头或香蕉水的幻觉，有种独特魔幻感，而后是沈稳的花香，不会晕香，持香度还不错，喷出门也不会觉得雷的香~,东方花香调,紫罗兰、阿拉斯加海洋、绿莱姆、青香蕉,萨布兰加木兰花、紫罗兰、云南胡椒,白檀香、没药树,https://www.1976.com.tw/prod/2804,female,花香调,Halloween,100.0,13.89,15.5
Victoria's Secret Angel Gold 维多利亚的秘密天使黄金女性淡香精,2980.0,2350.0,100ml,温暖中又带著一点性感的感觉，有点甜，浓郁的花香加上果香，仿佛在一片花园里吃著水果般。,柑橘花香调,梨、金橘、文旦、红浆果、橙、香柠檬,郁金香、茉莉、栀子花、睡莲、牡丹,麝香、香草、琥珀、檀木、雪松,https://www.1976.com.tw/prod/14774,female,柑橘调,Victoria,100.0,21.14,23.5
Ariana Grande Sweet Like Candy 女性淡香精,2980.0,1690.0,100ml,对本蚂蚁而言，这瓶的味道实在是太棒了！甜甜的闻著觉得整个人都软软的（？）喜欢甜味的人可以收！,花果甜美调,黑莓、义大利佛手柑、水梨,鲜奶油、茉莉、金银花、鸡蛋花,黑醋栗、棉花糖、香草、松果,https://www.1976.com.tw/prod/14870,female,果香调,Ariana Grande Sweet Like Candy,100.0,43.29,16.9
Jo Malone 朱槿花芳醇香水迷你瓶 - Red Hibiscus,1500.0,880.0,9ml 喷式，无盒装,在热带森林中邂逅一朵珍稀鲜艳的花朵。夺目的红色木槿花香调，与一丝沙巴茉莉和香草的性感气息交相辉映。阳光般明媚，充满异国风情。,东方花香调,柑橘、酸橙,朱槿花、茉莉、依兰,香草,https://www.1976.com.tw/prod/22946,female,花香调,Jo Malone,9.0,41.33,97.78
Laura Biagiotti 萝拉女性淡香水,2690.0,2050.0,75ml 绝版收藏品 无胶膜包装 效期：2026.05,好骨董的香水，记忆中她很甜很多汁，像西瓜香瓜小麦汁，国中时的零用钱真的连买小香都奢侈，后来自己工作后又好难买到，现在可以看见她的踪迹真的很开心，想完满以前的残念而收藏。,花果清新调,荔枝、李子、绿草、桃、香柠檬、西瓜、巴西花梨木,仙客来、紫罗兰、小苍兰、茉莉、兰花、铃兰、玫瑰,檀木、琥珀、麝香、香草、香根草、雪松,https://www.1976.com.tw/prod/2802,female,清新调,Laura Biagiotti,75.0,23.79,27.33
Banana Republic Malachite 孔雀石女性淡香精,3280.0,1150.0,100ml 绝版品 效期2023.07 便宜卖,一开始完全是被它的瓶身吸引，个人也很爱孔雀石，然后又很好奇芒果青会是什么样的味道所以就买了，一开始的确会有一些很明显的酸味，就是那种青果的酸香，但比起芒果青，冬梨、牡丹这类比较浓郁的香味会越来越明显，所以它其实属于非常浓郁的花香，芒果青就只是瞬间，感觉属于冬天，喜欢牡丹的人应该会喜欢这款香水。,东方花香调,香水百合、胡椒、芒果青,冬梨、蔷薇、康乃馨、牡丹,檀香、香草、麝香,https://www.1976.com.tw/prod/5147,female,花香调,Banana Republic Malachite,100.0,64.94,11.5
Roberto Cavalli Florence 佛罗伦斯女性淡香精,4700.0,1699.0,75ml,很喜欢清新橙子香同时带温柔花香的感觉~华丽的瓶身对她增添了奢华感，最后琥珀也是我喜欢的后调~超赞,花香调,柑橘、黑醋栗,橙花、葡萄柚花、朱槿种子,广藿香、麝香、琥珀,https://www.1976.com.tw/prod/20049,female,花香调,Roberto Cavalli Florence,75.0,63.85,22.65
Escada Magnetism 触电女性淡香精,2900.0,1650.0,75ml,"这瓶香水是闻到友人身上的味道才知道的，之后就自己败了一瓶， 前味带点甜蜜顽皮女孩，中后味慢慢转变为性感女人， 我称之为""草莓吐司""却带点梅子酸，由于是香精，喷一点点就够味!",花果甜美调,罗勒、绿叶、小苍兰,梅子、黑醋栗、茉莉、铃兰、鸢尾花、小雏菊、杏仁花,琥珀、檀木、喀什米尔香草、麝香,https://www.1976.com.tw/prod/3626,female,果香调,Escada Magnetism,75.0,43.1,22.0
Juliette has a gun 带枪茱丽叶 Lipstick Fever 唇情欲燃淡香精 TESTER,4280.0,1799.0,100ml 无盒装，有瓶盖,我对带枪茱丽叶的所有香水赞不绝口，但《 Lipstick Fever》永远是我的最爱❤️,花果甜美调,覆盆子、紫罗兰,鸢尾、广藿香,香草、雪松,https://www.1976.com.tw/prod/21969,female,果香调,Juliette,100.0,57.97,17.99
MFK Feminin Pluriel 多漾之香女性淡香精,7700.0,6500.0,70ml,MFK Feminin Pluriel 多漾之香女性淡香精 以四种花香为基础，鸢尾花、茉莉花、玫瑰花和橙花，营造出美妙而现代的花香。,花香调,佛罗伦斯鸢尾花、紫罗兰、格拉斯五月玫瑰,埃及茉莉、橙花,香根草、印尼广藿香,https://www.1976.com.tw/prod/22410,female,花香调,Maison Francis Kurkdjian,70.0,15.58,92.86
Fcuk Friction Her 爱火女性淡香精,2860.0,780.0,100ml,成熟版的奶油椰子乖乖，一整个就是融化的奶油一样诱人，花香不明显，睡前喷一些，留香度可以到隔天中午，跟我一样喜欢诱人美食调的人，这只算是浓艳版，绝对要试一试，会有种被涂满奶油满足感（扑倒和被扑倒都合适^_^,诱人美食调,金银花、苹果花、红浆果,香草、奶油椰子、粉红茉莉花、棉花糖,麝香、白香根草、檀香木、琥珀、金发伍兹,https://www.1976.com.tw/prod/9194,female,美食调,Fcuk Friction Her,100.0,72.73,7.8
Cacharel Anais Anais L'Original 安妮女性淡香水(新包装),2580.0,1212.0,100ml 新包装,真的很经典的优雅气息的花香味，喷上这瓶香水 马上气质加分，味道很有特色，绝不会和别家香水味道相似，我个人是觉得一点都不输DIOR 的茉莉优雅，若是喜欢纯粹的花香的朋友，又喜欢穿裙装的人，这瓶值得收藏 。,花香调,风信子、金银花,百合、铃兰、茉莉、依兰、玫瑰,木质调、琥珀、香根草、苔藓、麝香,https://www.1976.com.tw/prod/13270,female,花香调,Cacharel Anais Anais,100.0,53.02,12.12
Elizabeth Taylor Gardenia 伊莉沙白泰勒栀子花女性淡香精,3300.0,1450.0,100ml,很「真实」的花香味，像是房中插了几枝栀子花，香气宜人，适合喜欢清新花香调的人。,草香清新调,铃兰、绿叶,栀子花、牡丹、兰花,麝香、康乃馨,https://www.1976.com.tw/prod/14697,female,清新调,Elizabeth Taylor Gardenia,100.0,56.06,14.5
Ariana Grande MOD Vanilla 摩德香草女性淡香精,3280.0,2299.0,100ml,Ariana Grande 打造原创香水MOD系列，Mod Vanilla 和 Mod Blush ，大胆色彩和时髦的曲线设计，营造出亲密而强大的体验。,诱人美食调,粉红小苍兰、李子、奶油,鸢尾草奶油、白果仁糖、茉莉,香草精、可可脂,https://www.1976.com.tw/prod/21381,female,美食调,Ariana Grande,100.0,29.91,22.99
Benetton Hot 班尼顿热水女性淡香水,850.0,499.0,100ml,国中时候的班对，平价的就用热水冷水，中价的就用可乐，高价的就用水之恋风之恋，旁边一堆人都用冷水热水，每天被勋被闪，都很不爽。不过长大之后好好地再闻它，发现它不难闻，尤其是它和汗水结合后气味很迷人呢！,柑橘清新调,柠檬、佛手柑和紫檀,山谷百合、水中茉莉、鸢尾花、杏树,檀香木、西洋杉、橡木、琥珀、香草、麝香,https://www.1976.com.tw/prod/3439,female,清新调,Benetton Hot,100.0,41.29,4.99
Vera Wang Princess 公主女性淡香水,2900.0,1450.0,100ml,一开始是清甜活力的苹果香，紧接著散发出浓郁的黑巧克力香和香草甜味，就像冰淇淋一样甜美可口！是能被普遍接受的味道~比较适合秋冬喷喔。,花果清新调,青苹果、黄金杏仁、柑橘、水百合,粉红番石榴、大溪地皇冠花、野生晚香玉、黑巧克力,雪纺香草、粉红冰霜、琥珀、木质香,https://www.1976.com.tw/prod/3825,female,清新调,Vera Wang,100.0,50.0,14.5
Kate Spade Cherie Je T'Aime 啵啵爱恋淡香精,3200.0,1399.0,100ml,甜美的果香花香型香水，是一款宜人的春夏香氛。,花果甜美调,百香果、椰子水、苦橙叶,含羞草、橙花、双办茉莉,东加豆、雪松、喀什米尔,https://www.1976.com.tw/prod/22814,female,果香调,Kate Spade,100.0,56.28,13.99
Clinique Happy 倩碧快乐女性香水,3000.0,999.0,50ml,"我只能说,喜欢柑橘味的女孩一定很爱这瓶女香,一穿上她心情真的好好,正如现在我每天的景况",柑橘清新调,红宝石葡萄柚、柑橘,玉兰、百合,金银花、百合,https://www.1976.com.tw/prod/2605,female,清新调,Clinique Happy,50.0,66.7,19.98
Elizabeth Taylor White Diamonds 伊莉沙白泰勒白钻女性淡香水,3880.0,1880.0,100ml,划时代的经典。这是小时候亲戚送来给母亲的香水，味道非常的浓香，正如伊丽莎白敢爱敢恨的特质，感觉是出席隆重的宴会 艳冠群芳的香水，成熟女性适用。,花香调,橙、百合、奈若利橙花、和佛手柑,义大利鸢尾根、康乃馨、肉桂、埃及晚香玉、茉莉、土耳其玫瑰、依兰、水仙,琥珀、广藿香、麝香、橡苔、檀木,https://www.1976.com.tw/prod/10413,female,花香调,Elizabeth Taylor White Diamonds,100.0,51.55,18.8
