name,original_price,special_price,specification,description,fragrance,top_notes,middle_notes,base_notes,detail_url
Penhaligon's Endymion 潘海利根 牧羊少年 古龍水(恩狄米翁),"3,280","2,780",30ml,"一開始主調是薰衣草，柑橘，皂香，香草组成。薰衣草乾燥中帶點微鹹粉甜質感，香草混合淡淡的奶味。香水的脂粉味濃郁，但好在有柑橘的香氣，使得甜蜜氣息中有一絲明亮。
牧羊少年給我的感覺就像是仗着自己的美貌，肆無忌憚享受顏值的寵兒，那麼的想親近但又不容許褻玩的體驗。",東方清新調 、 皮革香調,佛手柑、橘子、薰衣草、鼠尾草,天竺葵、咖啡精華,岩蘭草、肉豆蔻、黑胡椒、小豆蔻、麝香、皮革、檀香、薰香、乳香、沒藥,https://www.1976.com.tw/prod/7012
Vince Camuto 文斯卡穆托都會經典男性淡香水(黑色外盒),"2,750","1,490",100ml,一直很喜歡木調香，但女香的木調款真的不好找，再1976也沒找到這款的同名女對香，索性給他試一下男香~!!整體味道有種冷冽帶著神祕有沉著內歛的感覺，就算是女生使用，也能有種很獨特的性感氣質，還帶著一種聰明幹練的感覺。,木質東方調,義大利佛手柑、橘子、黑胡椒,薰衣草、肉豆蔻、鳶尾花、皮革,琥珀木、檀香、香根草、廣藿香、麝香,https://www.1976.com.tw/prod/11567
Loewe Esencia 黑色圓舞曲男性淡香水,"4,030","2,650",50ml,LOEWE在1988年推出 Esencia 羅威風采男性淡香水 ，新鮮而辛辣的香氣，卻以非常優雅的方式呈現，喜歡經典香水的你，絕對不能錯過！,草香清新調 、 木質東方調 、 辛辣調,艾蒿、杜松子、薰衣草、青草調、龍蒿、薑黃、佛手柑、檸檬、苦橙葉,枸杞、肉荳蔻、羅勒、茉莉、橙花、鈴蘭、玫瑰、松樹針、天竺葵、黑醋栗,東加豆、皮革、檀香、冷杉、琥珀、廣藿香、麝香、橡木、香根草、雪松、芝麻,https://www.1976.com.tw/prod/15043
Marina De Bourbon Le Prince Gentleman 紳士王子男性淡香精,"3,300","1,580",100ml,柑橘的香氣和精心挑選的香料和木香調交織，展現了男性的強度和沉穩。,木質花香調,鳳梨、佛手柑、小荳蔻,仙客來、橙花、茉莉,雪松木、白麝香、琥珀,https://www.1976.com.tw/prod/22989
Davidoff Essentials Blue 大衛杜夫藍色境界男性淡香水,"2,800",950,110ml,Davidoff Essentials Blue 大衛杜夫藍色境界男性淡香水 非常適合日常休閒使用，無論您是出遊還是運動。它清新而充滿活力的香氣散發著勃勃生機，是熱愛生活冒險的男士的理想之選。,草香清新調 、 柑橘清新調,柑橘、薄荷、薰衣草,茉莉、羅勒、廣藿香,琥珀、麝香、雪松,https://www.1976.com.tw/prod/23270
Abercrombie & Fitch First Instinct 同名經典男性淡香水,"2,900","1,450",100ml,我喜歡那前調的甜味，儘管頗為刺激，在包著大外套的冬季，隱隱透出甜甜暖暖的味道，足以令女孩們為之瘋狂...,柑苔調 、 辛辣調,琴酒、雞尾酒、奇瓦諾果,紫羅蘭、胡椒,雪松、琥珀、檀香,https://www.1976.com.tw/prod/14132
Paco Rabanne XS Excess 超越男性淡香水,"3,300","1,650",100ml,東方調的Paco XS 超越男香流露著一股薑味的溫暖辛辣...佛手柑的清新隨著時間消逝，漸漸地在檀香的包圍下沉澱！這款香水是非常適合東方男性的香水喔！迷迭香搭配薰衣草是一種非常迷人的味道，很像拉丁情人在那邊誘惑著妳，希望妳能跟他激情一番！,木質花香調,迷迭香、柑橘、龍蒿、薄荷、佛手柑、檸檬,香菜、杜松、鼠尾草、波旁天竺葵、巴西玫瑰木,琥珀、廣藿香、檀香、麝香、香草、橡苔、雪松,https://www.1976.com.tw/prod/3979
Mercedes Benz Sea 三芒星 海洋淡香精,"4,150","1,976",100ml,"三芒星經典香氛系列引領大家進入大自然的嗅覺之旅，
如同一望無際的寬闊大海般，吸引對冒險的渴望，
海洋帶來一股如海浪拍打海岸的清新感受。",柑苔調 、 海洋清新調,柑橘,紫羅蘭葉,海藻、廣藿香,https://www.1976.com.tw/prod/21674
Lalique White 白光時尚型男 男性淡香水,"3,500","1,280",125ml,微酸清新的檸檬味慢慢進入麝香基底! 很明亮潔白! 有如洗完澡後換上乾淨的白色襯衫般的感覺! 夏天用最OK!,木質花香調,樹脂、柑橘,紫羅蘭,麝香、白琥珀、西洋杉,https://www.1976.com.tw/prod/7833
Kenzo Homme Intense 藍色海洋男性淡香水行動香水,"1,680",499,10ml 噴式,雖然以海洋來命名，但是整體感受上相當地木質，氣味上有點像le Labo 33，不過這一款更為清新，在無花果的配合下，也帶出更多乾燥木頭下的層次，呈現一種優雅又氣質的陽剛氛圍，擴香與持香能力也很不錯，便宜價格下卻擁有沙龍香的層次。,木質調 、 海洋清新調,Calypsone、海洋調、粉紅胡椒、辛香料,無花果、無花果樹、香根草,檀香木、Akigalawood 、廣藿香,https://www.1976.com.tw/prod/22642
Givenchy Pour Homme Blue Label 紀梵希牛仔紳士男性淡香水,"3,000","1,750",100ml,第三罐了，從沒想過會有買不到他的一天，這讓我只能快點來這裡打包幾罐回家。因為我可能再也找不到一罐香水，就像是將葉子與枝幹處切斷之後流出的汁液，揉合了淡淡的甜味但卻仍然清新耐聞，帶有著奶香的後味但卻不膩，持久度高，男女皆愛，像來自大自然的氣息。,海洋清新調,橙橘、葡萄柚、海洋草,蘭姆、胡椒、豆蔻、苦艾草,香根草、西洋杉、乳香木,https://www.1976.com.tw/prod/2642
Loewe Esencia 黑色圓舞曲男性淡香精版本,"5,280","3,180",50ml,LOEWE在1988年推出 Esencia 羅威風采男性淡香水 ，新鮮而辛辣的香氣，卻以非常優雅的方式呈現，喜歡經典香水的你，絕對不能錯過！,草香清新調 、 辛辣調,紅椒漿果、羅勒、龍蒿,,,https://www.1976.com.tw/prod/21739
Chanel Allure Sport 香奈兒傾城之魅運動清新古龍水,"3,300","2,980",50ml,西西里柑橘的清爽香氣在瞬間四溢，賦予香奈兒 ALLURE 男性運動清新古龍水振奮精神的活力泉源。獨活草-欖香的細膩香氣綻放些許辛辣、刺激的調性，吹來濃郁卻又充滿活力的清新微風。活潑熱情的辛辣感更與西洋杉和琥珀香氣相互呼應，帶出香氣本質中的男性力量。最後，柔和的白麝香讓木香調更顯溫暖，性感持續綿延。,,,,,https://www.1976.com.tw/prod/8844
Maison Margiela At The Barber's 在理髮廳男性淡香水,"2,800","1,960",30ml,"想像一下，黃昏時分，你身著華麗的晚禮服，步入理髮店，坐在老式理髮皮椅上。剪髮師為你理髮與剃鬚。店內有免費的美式咖啡，還有淡淡的煙草氣息，以及剃鬚膏和頭髮用品，帶來的清新麝香和柔和的薰衣草味，仿佛回到了那個經典的時代。

這款香水兼具了清新與溫暖，令人感到沉穩與鬆弛感。如同每一次到理髮院一般，帶給你一段療癒的時光，為你的日常生活增添一份獨特的氣息。",草香清新調 、 辛辣調,比加拉德精華、羅勒、黑胡椒,天竺葵、薰衣草、迷迭香,零陵香豆、艾維尼、白麝香、零陵香豆、白麝香、黑胡椒、迷迭香、羅勒,https://www.1976.com.tw/prod/18970
Trussardi Uomo 百年紀念款男性淡香水,"2,080","1,080",30ml,相當暖的味道，成熟內斂卻又不失自信的感覺，中後味相當吸引人，冬天時顯得格外出色苔癬和皮革的後味完全襯托出一個人的品味和成熟! 適合正式場合西裝、襯衫等打扮非常加分!,柑苔調 、 皮革香調,義大利檸檬、佛手柑、松香、肉荳蔻,鼠尾草、天竺葵、紫羅蘭,廣藿香、苔蘚調、皮革調,https://www.1976.com.tw/prod/12510
Kenneth Cole Vintage Black 復古黑男性淡香水,"2,850","1,450",100ml,散發出來的一點柑橘香一點陽剛木頭香，混合了龍舌蘭酒，乍聞起來像是涼爽飲料，建議外出休閒用！,青檸、草香調、粉紅葡萄柚,,白胡椒、薰衣草、龍舌蘭酒,橡木、檀香,https://www.1976.com.tw/prod/15660
Chanel Allure Sport 香奈兒傾城之魅運動清新古龍水 TESTER,"4,450","3,350",100ml 原廠環保紙盒包裝，無瓶蓋,"果香的微甜無香草之膩，清新中帶點溫潤，比雲淡風輕濃幾分，但是調性差不多，
非常百搭，適合各種年齡上班上學皆宜，無侵略性，可增進人際關係 ，
應該不會有人討厭這味道 (開會 演講 太正式的場合不太適合)",,,,,https://www.1976.com.tw/prod/20385
Penhaligon's Endymion 潘海利根 牧羊少年 古龍水行動香氛(恩狄米翁),"1,800","1,199",10ml,雖然被歸類在男香，但女生使用也完全不違和～前調柑橘類的氣味很明顯，接著轉為帶有香料感的薰衣草咖啡香，後味木質調與奶香變得更加突出，並融合著肌膚的溫度。非常有質感的一款香水！,東方清新調 、 皮革香調,佛手柑、橘子、薰衣草、鼠尾草,天竺葵、咖啡精華,岩蘭草、肉豆蔻、黑胡椒、小豆蔻、麝香、皮革、檀香、薰香、乳香、沒藥,https://www.1976.com.tw/prod/21658
Dunhill X-Centric 登喜路中心點男性淡香水,"3,680","1,250",100ml 絕版收藏品 2016.12出廠 外盒凹陷無膠膜便宜賣,有點水生帶點溫暖木質味，每天噴這支也不會膩，可以搭襯衫或是休閒T，正確來說是一年四季都能噴的日常香水,木質花香調,葡萄柚、小荳蔻、香柏、山艾,小蒼蘭、玫瑰、蓮花、白扁柏,檀香、琥珀、廣霍香,https://www.1976.com.tw/prod/2635
Givenchy π 紀梵希圓周率男性淡香水,"3,800","2,080",100ml,第一次用這罐香水就驚為天人。的確是香甜粉味，非常持久約8小時以上，但絕對不會膩人，精美的三角雕花造型，整體瓶身設計令人愛不釋手，記憶中只有特殊場合才捨得使用，是香水中的精品。,木質調,羅勒、迷迭香、龍蒿和柑橘,天竺葵、橙花、百合山谷和八角,香草、零陵香、雪松、安息香、杏仁、黃糖,https://www.1976.com.tw/prod/11064
Kenzo Homme 墨竹男性淡香精,"2,840","1,976",60ml,令人驚奇的創新香調淡香精，先不說它的 驚人持香時間，跟本是野獸等級！ 剛噴下去 是淡淡海味 瞬間閃過一點無花果鹹味 ，然後直接進入 深沈濃厚的皮革香氣 最後是混著 廣霍香的 皮革香 持久而特別 非常令人著迷 ，回頭率超高 ，剛噴的第一天 就有 四個人問你的香水好香好特別！！ 值得擁有這瓶經典香精！調香師Quentin Bisch 又再一次 創造 傳奇！,海洋清新調 、 皮革香調,海洋調,皮革,廣藿香,https://www.1976.com.tw/prod/20285
Loewe 7 第七樂章男性淡香水,"4,030","2,650",50ml,Loewe 7真的很特別，今天收到第一次用，就引來朋友的詢問。因為真的特別，不想分享，不想和人家撞香，我只能說，這神秘感十足的味道，想要自己去1976香水網，一瓶一瓶試吧。^^,木質東方調,胡椒、紅蘋果,鈴蘭、奈若利橙花、焚香,雪松、香根草、麝香,https://www.1976.com.tw/prod/9590
Abercrombie & Fitch First Instinct Blue 湛藍男性淡香水,"2,900","1,450",100ml,"觀望許久、終於將它入手，
就是它了、我夢想中的男香，
特殊的香調讓人顯得自信，
中味的胡椒及後味的檀香，
散發出活潑又不失穩重的氣質，
出門前噴了幾下、幾乎可以維持到下班，
好香水真的可以讓人維持好心情。",東方清新調,佛手柑、蘋果、荳蔻,迷迭香、薰衣草、胡椒,專利配方AMBERTONIC™、檀香、東加豆,https://www.1976.com.tw/prod/15962
Abercrombie & Fitch First Instinct Blue 湛藍男性淡香水 TESTER,"2,900","1,160",100ml 原廠環保紙盒包裝，無瓶蓋,佛手柑略為輕拂後，薰衣草搶出來當主角，迷迭香和蘋果味伴隨其中，後味的檀香、東加豆與萬寶龍傳奇經典男香後調相似，不會濃烈刺鼻有著薰衣草粉感，輕熟男的香水款式適合春秋季節穿它。,東方清新調,佛手柑、蘋果、荳蔻,迷迭香、薰衣草、胡椒,專利配方AMBERTONIC™、檀香、東加豆,https://www.1976.com.tw/prod/16649
Givenchy π 紀梵希圓周率男性淡香水 TESTER,"3,800","1,750",100ml 原廠環保紙盒包裝，內容與正貨相同,杏仁、迷迭香與八角，乃這款香水的三大主角！初聞會有點刺激性，但在酒精揮發後會帶來一股中性乾燥的甜氣，完全不會有膩感，可以清楚捕捉到香草與杏仁的味道，讓他一年四季都可以輕易穿戴！另外氣味也非常獨特，在其身上不會發現其他商業男香的影子，於人群中能夠勇敢地站出來！,木質調,羅勒、迷迭香、龍蒿和柑橘,天竺葵、橙花、百合山谷和八角,香草、零陵香、雪松、安息香、杏仁、黃糖,https://www.1976.com.tw/prod/21717
Trussardi Uomo 百年紀念款男性淡香水 迷你瓶,600,280,7ml 抹式,很成熟適合三十歲以後的西裝族噴的一罐香水，瓶身的質感顯得它的成熟帶有一點高尚，是種女生擁在懷裡會忘不了的味道，肉豆蔻的成分混和菸味會形成一個很特別的味道還可以蓋過菸味。,柑苔調,義大利檸檬、佛手柑、松香、肉荳蔻,鼠尾草、天竺葵、紫羅蘭,廣藿香、苔蘚調、皮革調,https://www.1976.com.tw/prod/15413
Dunhill Custom 訂制英倫男性淡香水,"2,850","1,380",100ml,第一次聞有一種在誠品裡面逛街會聞到的那種木頭家具的味道，但是特別的是因為添加蘋果的關係，聞起來反而又有一種甜甜的味道。木頭沉穩味道再混上甜甜的蘋果香氛，感覺很適合年輕的紳士，沉穩卻又不老氣。,木質調 、 辛辣調,蘋果,黑胡椒,薰香、香柏,https://www.1976.com.tw/prod/8720
YSL M7 男性淡香水,"4,950","3,360",80ml,烏木始祖M7的繼承人，純粹的雄性氣息，尊貴、霸氣、陽剛，不管是男性或女性都本能的無法抗拒M7那超越嗅覺的吸引力。,木質東方調,柑橘,廣藿香,法國勞丹脂、沒藥、沈香木,https://www.1976.com.tw/prod/15294
Paco Rabanne Black XS 黑騎士男性淡香水(新版),"3,300","1,850",100ml,實際用起來覺得跟未改版的沒有差很多。一噴就會聞到熟悉的濃濃甜果香味卻不膩，讓人不禁想多吸幾口，檸檬的味道也很明顯地有出來，柑橘調則沒有太大感覺。中後香維持原有類似的檀香的味道，非常喜歡。,木質東方調 、 柑橘調 、 辛辣調,加勒比海檸檬、鼠尾草、萬壽菊、柑橘調,果仁糖、肉桂、香脂、黑豆蔻,黑琥珀、廣藿香、烏木、紅木,https://www.1976.com.tw/prod/16577
Armaf Club De Nuit Precieux I 夜色珍藏香精,"3,980","2,280",55ml,Armaf Legesi 男性淡香精的瓶身以黑色為主調，結合銀色瓶蓋語吊飾側邊的與格紋設計，呈現出強烈的現代感與陽剛氣息。整體輪廓方正穩重，展現出粗獷卻不失質感的設計，香水1976強力推薦！,木質東方調,佛手柑、檸檬、粉紅胡椒、黑胡椒、松蘋果、梨子、焦糖,茴香、鈴蘭、茉莉、白木、橡苔,琥珀、雪松木、皮革、廣藿香、白麝香、香草、降龍涎香醚,https://www.1976.com.tw/prod/22890
Armaf Tag Him 男性淡香水,"2,680","1,250",100ml,好熟悉的味道，持香度4~5小時，帶點溫暖柑橘調，適合白天使用，很紳士也很適合辦公室主管的男性香味，帶點甜甜的陽剛，後味讓人有一股安心感，整體而言是斯文型白領紳士，但不太適合給容易流汗的男生用，算是休閒用香水:D,木質調 、 柑橘調,香檸檬、葡萄柚、檸檬、粉色胡椒,生薑、薄荷、肉荳蔻、核仁、薰衣草,雪松、廣藿香、檀木、香根草,https://www.1976.com.tw/prod/14961
Penhaligon's Endymion Concentre 潘海利根 牧羊少年淡香精版本(恩狄米翁),"7,300","5,950",100ml,"雖然是中性香，但在我身上的味道卻暖暖的，柔柔的。女生用也非常適合。
對我來說鼠尾草的味道尤為明顯。
中後段溫暖的木質調出來，朋友說有一種小北鼻的香味，有點奶，是讓人安心的味道。
原本只買了小香試用，因為太喜歡了就直上100ml",東方清新調 、 皮革香調 、 辛辣調,佛手柑、薰衣草、鼠尾草,天竺葵、絨面革,肉豆蔻、皮革、薰香,https://www.1976.com.tw/prod/17822
Paco Rabanne Black XS 黑騎士男性淡香水,"3,100","2,150",100ml,一開始是異於一般男香的誘人甜味，讓人聯想到熱帶水果的濃郁熱情，中段與後段會轉成木質調的沉穩，但是不會像一般的木質調這麼的嚴肅強悍，給我的印象比較像是一種輕鬆自在卻又帶點神秘憂鬱的感覺，算是非常有個人風格的一款香水。曾經有女生拿去噴過，他的體溫屬於偏低的，味道沒有像噴在我身上這麼濃烈就是了，結果他還是整瓶搶走說要當睡香。這也是一款很不錯的撲倒香，沒錯，讓女生撲倒你這個聞起來香甜綿密絲滑的熱情壞小子。,木質東方調,加勒比海檸檬、卡拉曼茲水果,果仁糖、肉桂、、黑豆蔻,黑色琥珀、廣藿香、烏木,https://www.1976.com.tw/prod/2622
YSL Opium 鴉片男性淡香水,"4,600","3,280",100ml,擴散持久中上，辛辣東方調有些嗆，騷氣、侵略、微甜、脂粉、熟齡，經典東方男香。,,黑醋栗、八角,薑、花椒,吐魯香脂、雪松、香草,https://www.1976.com.tw/prod/4158
Loewe 7 Elixir 第七樂章男性濃香精,"6,445","3,880",50ml 除碼商品,和 Bottega Veneta pour homme 很像，真是個驚喜。,木質東方調 、 辛辣調,辣椒、廣藿香、琥珀、岩薔薇,,,https://www.1976.com.tw/prod/22962
YSL Kouros 科諾詩男性淡香水,"4,600","2,550",100ml,經典中的經典，品味獨具一格，堪為YSL最傑出也最為人所熟知的powerhouse oldschool 的作品，現在根本找不到任何與之相同或類似的產品。前味怪異且刺鼻，但短暫停留後，接著便是超強持久又令人心醉神迷的中後味，彷彿是像夜來香+淡幽的焚香+清新皂香的綜合體，舒適又深具魅力，這款是我個人心目中香水的重量級aniki至尊大哥！若想擺脫現今香水市場主流的框架，這款絕對是上乘的首選。,木質東方調 、 皮革香調,艾草、佛手柑、胡荽,丁香、茉莉,橡木苔、龍涎香、沉香、皮革,https://www.1976.com.tw/prod/6442
Azzaro The Most Wanted 男性淡香精 (Intense),"3,200","2,790",50ml,Azzaro The Most Wanted 以馥奇木香琥珀香調開啟了新的嗅覺篇章，營造出令人上癮、精緻且富有磁性的香氣。,木質調 、 辛辣調,小荳蔻,太妃糖,琥珀木,https://www.1976.com.tw/prod/21092
Abercrombie & Fitch A&F Fierce 天生無畏 男性古龍水 (肌肉男新版),"1,800","1,050",30ml,這味道根本是讓人變成行走的荷爾蒙，剛開始的味道是非常的濃郁，隨著時間拉長，漸變成清新的香味，味道上的變化算是很有層次，是會吸引異性一款香水，會讓使用者愛不釋手，非常值得推薦！,木質調,海洋微風,麝香,檀香,https://www.1976.com.tw/prod/21999
Armaf Legesi 男性淡香精,"3,080","1,380",100ml,Chanel Platinum Egoiste 平替版！,木質東方調,薰衣草、迷迭香、苦橙葉,玫瑰、茉莉、白松香、鼠尾草,檀香、麝香、雪松、橡苔,https://www.1976.com.tw/prod/22591
Penhaligon's Quercus 潘海利根 皇家橡樹古龍水,"3,280","2,980",30ml,我的第一瓶香水，也是因為他入坑潘海利根！最喜歡換完床罩後，噴一點在上面，睡覺都覺得好愉悅。味道非常清爽、高級，後來才知道是林酒店也是使用這系列的沐浴用品。,,檸檬、萊姆、甜橘、佛手柑,茉莉、野百合、小荳蔻,橡樹苔、檀香、白松香、麝香、琥珀,https://www.1976.com.tw/prod/6274
Abercrombie & Fitch A&F Fierce 天生無畏 男性古龍水 (肌肉男新版) TESTER,"3,090","1,299",100ml 原廠環保紙盒包裝，有瓶蓋,這味道根本是讓人變成行走的荷爾蒙，剛開始的味道是非常的濃郁，隨著時間拉長，漸變成清新的香味，味道上的變化算是很有層次，是會吸引異性一款香水，會讓使用者愛不釋手，非常值得推薦！,木質調,海洋微風,麝香,檀香,https://www.1976.com.tw/prod/22789
Paco Rabanne Pour Homme 出色男性淡香水,"3,850","1,699",100ml,這款味道是介於YSL Kouros與姬龍雪的Drakkar Noir，兼具這兩者氣味的特性，成熟低調、率性灑脫，香韻持久厚重、舒爽怡人又百搭，若是鍾情於這類的經典老香者，這款絕對是基本必備。,東方清新調,佛手柑、柑橘、香草,茉莉、香橙花、檀香、香根草,木香、麝香,https://www.1976.com.tw/prod/3841
Dunhill Edition 登喜路經典男性淡香水,"2,600","1,450",100ml,"請靠近噴撒處深深的吸一口。薰衣草、胡椒、檸檬的味道深深的在鼻腔內打轉，很玄！如此奇特，但又不衝突，反倒越聞越好聞。辨識的極高，但又不高調，很有個性的一支香水！

p.s：拿來運動使用，和著汗水散發的香氣很迷人！",柑橘清新調,薰衣草、肉荳蔻、佛手柑、檸檬,康乃馨、茉莉、天竺葵、百合、鼠尾草、仙客來,香根草、橡樹苔、雪松、琥珀、陵香豆、冷杉,https://www.1976.com.tw/prod/2662
Armaf Ventana 文塔納男性淡香精,"3,280","1,350",100ml,推薦給喜歡Dior Sauvage 曠野之心的你！,木質東方調,葡萄柚、檸檬、橘子,薰衣草、天竺葵、廣藿香、香根草,雪松、琥珀、珍貴木材,https://www.1976.com.tw/prod/18986
Azzaro The Most Wanted 頭號通緝犯男性香精 Parfum,"4,000","3,450",100ml,Azzaro The Most Wanted 以辛辣木香調開啟了新的嗅覺篇章，營造出令人上癮、精緻且富有磁性的香氣。,木質東方調 、 辛辣調,生薑,木質調,香草,https://www.1976.com.tw/prod/21823
Michael Kors 經典男性淡香精,"4,100","2,460",100ml,Michael Kors 經典男性淡香精充滿活力和歡愉，佛手柑和薰衣草的清新香氣，混合著粉紅胡椒的清新。隨著時間推移，鼠尾草和天竺葵的香氣交織，展現出現代男性的自信與魅力。廣藿香、香根草和琥珀的溫暖香氣如同夕陽下的沙灘，帶來無盡的溫暖與舒適。,草香清新調 、 海洋清新調,粉紅胡椒、薰衣草、佛手柑,鼠尾草、海洋調、天竺葵,琥珀、香根草、廣藿香,https://www.1976.com.tw/prod/23152
Ralph Lauren Polo 67 馬球67號男性淡香水,"3,650","1,976",125ml,Polo 67 男性淡香水，結合了新鮮的柑橘和溫暖的木質香調，創造出強烈而無可否認的陽剛氣息。 Polo EST 透過精選的卡拉布里亞佛手柑、鳳梨香調和泥土香根草的香氣散發出清新氣息。,佛手柑、水生香調、薰衣草,,鳳梨、天竺葵、葵花籽、快樂鼠尾草,香根草、檀香、廣藿香,https://www.1976.com.tw/prod/22446
Michael Kors 經典男性淡香精迷你瓶,900,290,5ml 抹式,Michael Kors 經典男性淡香精充滿活力和歡愉，佛手柑和薰衣草的清新香氣，混合著粉紅胡椒的清新。隨著時間推移，鼠尾草和天竺葵的香氣交織，展現出現代男性的自信與魅力。廣藿香、香根草和琥珀的溫暖香氣如同夕陽下的沙灘，帶來無盡的溫暖與舒適。,草香清新調 、 海洋清新調,粉紅胡椒、薰衣草、佛手柑,鼠尾草、海洋調、天竺葵,琥珀、香根草、廣藿香,https://www.1976.com.tw/prod/21489
Davidoff Champion 王者風範男性淡香水,"2,900","1,100",90ml,君臨天下的感覺聞起來很強壯，讓人信任的味道卻帶有點運動風，衝業績的時候就噴上他吧,柑苔調,佛手柑、檸檬,白松、鼠尾草,雪松、橡苔,https://www.1976.com.tw/prod/8047
Kenneth Cole Mankind HERO 當代英雄男性淡香水,"2,700","1,490",100ml,我覺得前中味有梅子的味道，後味是舒服的木質味。冬天出去一整天回家隱約還可以聞到，留香時間應該5~7小時沒問題。適合冬天使用的香水，女生朋友對這個味道也覺得不錯。,木質東方調,清新山林、義大利檸檬、芫荽籽,桃木、薰衣草、快樂鼠尾草、黑色香草,香豆素、琥珀木、白苔癬、麝香,https://www.1976.com.tw/prod/15113
Loewe Solo Atlas 阿特拉斯男性淡香精,"4,450","2,450",50ml,這是一款偏甜的中性橙花香，前調由粉紅胡椒帶出點辛辣感，爾後則是橙花築起的柔潤甜美大衣，持續約6至8個小時，但也不會讓人窒息，反而能一直沉浸在花香氣息中，帶點特色又實穿。,柑橘花香調,橙花、柑橘、粉紅胡椒,橙花、苦橙葉、乳香、扁豆、鹽,乳香、海地香根草、麝香、鈴蘭、牡丹、琥珀,https://www.1976.com.tw/prod/20031
Armaf Le Parfait 極致完美男性香水,"2,390","1,180",100ml,Creed 愛爾蘭之心的完美詮釋。磁吸瓶蓋、與瓶身創意有俐落高檔的感覺。前味出來豐富清爽，鳳梨檸檬醋栗的果香搭載著分子較大的佛手柑；個人覺得中味是無玫瑰與茉莉，但反而薰衣草的花香調，後味就是ambroxane、musk乾燥感。一聞到這款香水，我腦中立刻浮現愛爾蘭國球rugby，在青草地上裝甲般的肌肉大個相互碰撞，青草味、男性賀爾蒙瀰漫在空氣中，超適合爽朗陽光的男子漢！,柑橘調,佛手柑、黑醋栗、鳳梨、檸檬,玫瑰、辛香料、茉莉,龍涎香、麝香、香草、廣藿香,https://www.1976.com.tw/prod/17066
