name,original_price,special_price,specification,description,fragrance,top_notes,middle_notes,base_notes,detail_url
Mercedes Benz Man Fresh 賓士天峰藍調男性淡香水 TESTER,"3,250","1,350",100ml 原廠環保紙盒包裝，無瓶蓋,Mercedes Benz Man Bright 賓士銀霧冰泉男性淡香水，新鮮、爽脆、令人愉悅。,茶香清新調 、 柑橘清新調,佛手柑、青蘋果、梨子,白茶、鼠尾草、雪松,癒創木、龍延香醚、麝香,https://www.1976.com.tw/prod/19290
Dior Homme Parfum 男性香精迷你瓶,"1,500",550,7.5ml 抹式,以前的花花公子變成一個愛家溫柔的好男人，現在這款香水很適合已婚男人，它的味道會給另一半滿滿的安全感！,東方調,鳶尾花,琥珀,廣藿香、香根草,https://www.1976.com.tw/prod/22464
Issey Miyake NUIT 三宅一生一生之水月夜男性淡香水,"2,600","1,650",75ml,第一次噴上他的香水真的覺得普通，過了沒多久開始讚嘆甚至驚艷，一場華麗的表演秀，老實說這瓶我真的非常非常有嚇到，他真的是我買過最特別的一罐！,木質東方調,佛手柑、葡萄柚,皮革、黑胡椒、樹木、香根,黑木材、天竺薄荷、薰草豆,https://www.1976.com.tw/prod/12058
Prada Luna Rossa Black 卓越至黑男性淡香精,"3,850","2,699",50ml,完全不透明的香水瓶，原本亮眼的 PRADA 指標 色染上至高無上的黑， PRADA 商標以脫穎而出的白 展現。黑色玻璃瓶與底部如夜晚的河流般漆黑而閃耀。,木質調,佛手柑,白芷、廣藿香,麝香、琥珀、香豆精,https://www.1976.com.tw/prod/16367
Police To Be King 國王男性淡香水,"2,280","1,000",125ml,太喜歡這個瓶身，所以抱持著就算不好聞放著當擺飾也很有型的心態買下，結果出乎意料的好聞，是瓶表裡如一的香水。喜歡檸檬味的前調有汽水般的清涼感，帶著花草香的木質調中後味讓我聯想到魔戒裡的艾隆王......,木質調 、 辛辣調,肉豆蔻、荳蔻果實、西西里檸檬,琥珀木、喀什米爾木、薰衣草,廣藿香、檀香木、香根草,https://www.1976.com.tw/prod/11980
Montblanc Legend Night 萬寶龍傳奇紳夜男性淡香精,"3,400","1,699",100ml,一直都買這系列的香水送給男友，男友也很喜歡，佛手柑帶點木質調的香味，给人沉穩的感覺，搭配薰衣草、雪松，又多加了一點從容不迫的安心感。,木質調 、 辛辣調,佛手柑、鼠尾草、薄荷、豆蔻,雪松、薰衣草、紫羅蘭蘋果、冷衫樹脂,香根草、黑香草、廣藿香、麝香,https://www.1976.com.tw/prod/15537
Mercedes Benz Man Bright 賓士銀霧冰泉男性淡香精,"3,450","1,590",100ml,薄荷和胡椒，會讓你覺得一開始如同直率的小男孩，很陽光開朗但又很衝，有如賓士的個性，低調太難! 不過中後的味道以一股乳香柔和散播，又是熟悉的賓士安全感,草香清新調 、 東方清新調,佛手柑、薄荷、粉紅胡椒,薰衣草、乳香,零陵香豆、雪松、廣藿香,https://www.1976.com.tw/prod/19289
Issey Miyake NUIT 三宅一生一生之水月夜男性淡香水 TESTER(絕版珍藏品),"3,600","1,580",125ml 原廠環保紙盒包裝，有瓶蓋,我覺得讓我感覺像是一種很端莊的味道，不過到了後味就變得有點甜甜的，香味非常的持久至少有8~10小時。,木質東方調,佛手柑、葡萄柚,皮革、黑胡椒、樹木、香根,黑木材、天竺薄荷、薰草豆,https://www.1976.com.tw/prod/12570
Police To Be King 國王男性淡香水 TESTER,"2,280",880,125ml 原廠環保紙盒包裝，內容與正貨相同,一開始是被造型吸引的，但是實際使用後，發現Police To Be King不只有好看的外表。正如其名，KING的味道， 像是一個溫和的紳士、和善的國王。沒有辛辣的木味，經過調配後，木質以偏向溫暖沉穩的方式呈現。 濃度也是恰到好處!不會過於濃烈。也沒有因為木質感而感到老氣。非常耐聞的味道!,木質調 、 辛辣調,肉豆蔻、荳蔻果實、西西里檸檬,琥珀木、喀什米爾木、薰衣草,廣藿香、檀香木、香根草,https://www.1976.com.tw/prod/13016
MONTBLANC Legend Night 萬寶龍傳奇紳夜男性淡香精 TESTER,"3,400","1,250",100ml原廠環保紙盒包裝，有瓶蓋,前味是有質感甜甜的香味，充滿神秘與誘惑感，只要聞到就會讓人覺得你是一位優雅的紳士。,木質調 、 辛辣調,佛手柑、鼠尾草、薄荷、豆蔻,雪松、薰衣草、紫羅蘭蘋果、冷衫樹脂,香根草、黑香草、廣藿香、麝香,https://www.1976.com.tw/prod/15678
【身體系列】Acca Kappa 白麝香體香噴霧,"1,080",860,125ml,淡淡的清香味，另人神清氣爽，不會太濃太高調的味道，洗完澡噴上一些讓人很安心也很放鬆，很值得推薦~,柑苔調,,,,https://www.1976.com.tw/prod/8760
Paco Rabanne One Million PARFUM 百萬極致男性香精,"4,480","3,099",100ml 新包裝,"金光閃閃的金條造型瓶身，
承襲百萬系列男香奢華風格之外，
更加濃郁的「報復性」極致誘惑要你加倍自信，強勢回歸！",晚香玉、大溪地梔子花油、海鹽、龍涎香、太陽能香調、皮革、喀什米爾木麝香、松樹、勞丹,,,,https://www.1976.com.tw/prod/18615
Emporio Armani Stronger With You Absolutely 男性淡香精,"4,080","2,950",50ml,蘭姆酒和來自法國的薰衣草調和，增強了精緻的陽剛氣息，並以令人難以抗拒的果香和利口酒香調為特色。 Stronger With You Absolutely 香水蘊含著溫暖的香草氣息，煙燻雪松木為這款強勁的香水增添了圓潤感。,木質東方調,蘭姆酒、欖香脂、佛手柑,薰衣草、印蒿,香草、栗子、雪松、廣藿香,https://www.1976.com.tw/prod/22129
Police To Be 態度男性淡香水,"2,280","1,000",125ml,前味有點嗆鼻的柑橘香，讓人精神振奮但很快就散去，輕甜帶著暖味的木質香開始出現，非常的迷人性感。,木質清新調,紫羅蘭葉、葡萄柚、黑胡椒,德州雪松木、蘋果花、埃及天竺葵,白琥珀、廣霍香、羊絨木,https://www.1976.com.tw/prod/10647
Paco Rabanne PARFUM 百萬極致男性香精 TESTER,"4,480","2,380",100ml 原廠環保紙盒包裝，內容與正貨相同,"金光閃閃的金條造型瓶身，
承襲百萬系列男香奢華風格之外，
更加濃郁的「報復性」極致誘惑要你加倍自信，強勢回歸！",晚香玉、大溪地梔子花油、海鹽、龍涎香、太陽能香調、皮革、喀什米爾木麝香、松樹、勞丹,,,,https://www.1976.com.tw/prod/21641
HUGO BOSS Jeans 丹寧男性淡香水,"2,300","1,212",75ml,這瓶就像陽光暖男所會散發出來的味道，像是男星許光漢站在大片落地窗前，外面陽光打在身上的那種舒服感，一定要來入手的。,木質清新調 、 柑橘清新調,葡萄柚、萊姆,薄荷、杜松子,檀香、香根草、雪松,https://www.1976.com.tw/prod/20692
Dunhill 極速競藍男性淡香精,"3,550","1,650",100ml,前面清爽俐落，雖然味道有著知名品牌影子，但是我很喜歡中後味，整體感表現辛辣陽剛，淡雅橙花獨特香氣配上溫潤的木質調賦予沉靜感，味道豐富不失沉穩，此外擴散比我想像中的好:D,木質調 、 柑橘調,佛手柑、四季橘、降龍涎香醚,芫荽、海鹽、橙花油、綠豆蔻,印度檀香、龍涎香、廣藿香、漂流木,https://www.1976.com.tw/prod/18933
Emporio Armani Stronger With You Tobacco 男性淡香精,"7,600","4,450",100ml,溫暖、辛辣和煙熏的限量版，Emporio Armani 的 Stronger With You Tobacco 是一款迷人的混合物，散發著溫暖、精緻和一絲放縱的氣息。菸草和潛在甜味之間的相互作用創造了光滑、舒適和略帶美食的口感。,東方調 、 辛辣調,粉紅胡椒、黑胡椒、小荳蔻、欖香脂、鼠尾草,菸草、肉桂葉、辣椒、板栗,香草、琥珀、癒創木、安息香,https://www.1976.com.tw/prod/22365
Hugo Superman 超人限量版男性淡香精,"3,650","2,450",125ml,感覺就像超人在清新的山間空氣中翱翔，或在炎熱的天氣裡享受涼爽的微風，香水1976強力推薦,醛、柑橘香調、莓果,,薄荷,廣藿香,https://www.1976.com.tw/prod/22820
Police To Be Camouflage 態度迷彩男性淡香水,"2,280","1,280",125ml,以迷彩和探險為收藏的主題，圍繞著森林的氛圍，噴上To Be Camouflage 態度迷彩後將讓你散發神秘而迷人的男人味。,東方調,檸檬、小荳蔻、薄荷、紅蘋果,臭氧、薰衣草、肉荳蔻、肉桂、大黃、紫羅蘭,香草、薰草、羊絨木、海地香根草、琥珀、橙花,https://www.1976.com.tw/prod/13253
Dunhill 極速躍紅男性淡香精,"3,550","1,499",100ml,開頭就是清淡的柑橘果香，幾分鐘後來了溫暖絲柏木木質香調與乳香，這不是一種常見的氣味，對我來說它聞起來優雅而性感，散發著非常強烈的男性魅力，迷人的零陵香豆與麝香會隨著時間越聞越好聞，是一款層次感豐富又神秘的香水，留香時間也很不錯:D,木質東方調,暖陽調、黑胡椒、葡萄柚、柑橘、苦橙葉,絲柏木、天竺葵、乳香、胡椒複方,琥珀、雪松、零陵香豆、麝香、苔蘚、岩蘭草,https://www.1976.com.tw/prod/18934
Emporio Armani he 男性淡香水(2024版),"3,500","1,976",100ml,外型設計非常的簡約洗煉，鐵灰色的瓶身象徵著男性的深度和堅忍，香氣走的仍是非常復古和經典的調性，一點也不輕佻，給人非常穩重但又不老氣的感覺，絕對不是單調的東方木質調，可能是柑橘的關係，讓整體還保有些清新的能量，但整體來說是讓人很舒服的。,,柚子,小荳蔻、白麝香,香根草,https://www.1976.com.tw/prod/22915
Coach 時尚經典男性淡香水,"1,850",960,40ml,這罐真的很好聞，雖然是男香，但女生噴一點也不突兀！絕對是款回頭率極高的香水,東方清新調 、 柑橘調 、 皮革香調 、 辛辣調,綠梨、佛手柑、金橘,荳蔻、香菜、天竺葵,海地香根草、麂皮皮革、琥珀萃取,https://www.1976.com.tw/prod/15463
Emporio Armani he 男性淡香水(2024版) TESTER,"3,500","1,680",100ml 原廠環保紙盒包裝，內容與正品相同,外型設計非常的簡約洗煉，鐵灰色的瓶身象徵著男性的深度和堅忍，香氣走的仍是非常復古和經典的調性，一點也不輕佻，給人非常穩重但又不老氣的感覺，絕對不是單調的東方木質調，可能是柑橘的關係，讓整體還保有些清新的能量，但整體來說是讓人很舒服的。,,柚子,小荳蔻、白麝香,香根草,https://www.1976.com.tw/prod/22897
Maison Margiela Jazz Club 爵士俱樂部淡香水,"2,800","1,699",30ml,菸草與香根草揉碎後撒在一片柔軟的皮革上，整體營造的香氣氛圍溫暖又自帶個性，上皮之後會持續飄散出朗姆酒與香草的甜氣，卻不會濃膩，反而在皮革的陽剛感中，透露出一點柔美氛圍，相當適合秋冬使用，整體擴香與持香能力也表現不錯。,東方調 、 皮革香調,粉紅胡椒、橙花、檸檬,朗姆酒、鼠尾草、爪哇香根草,菸葉、香草、苯乙烯屬,https://www.1976.com.tw/prod/18965
Montblanc Legend 萬寶龍 傳奇至尊男性淡香精,"3,700","1,680",100ml,萬寶龍傳奇淡香精是經典傳奇的夜香板本也不為過. 奶油美食調性融和皮革.應屬誘惑香氣..,木質花香調 、 皮革香調,佛手柑、紫羅蘭,木質調、茉莉、木蘭花,橡苔、皮革,https://www.1976.com.tw/prod/18466
YSL MYSLF 男性淡香精,"4,000","2,800",60ml,生命中最重要的相遇就是與自己的相遇。,木質花香調,佛手柑,橙花,龍涎香、廣藿香,https://www.1976.com.tw/prod/21342
Coach 時尚經典男性淡香水 TESTER,"3,500","1,350",100ml 原廠環保紙盒包裝，內容與正貨相同,聞起來感覺就像是一個穿著西裝的30~40歲暖男，斯文中帶點溫柔，給人一種容易親近的好感！非常好聞的香味，聞過很多香水，這味道很特別，是一種難忘的舒服感,東方清新調 、 柑橘調 、 辛辣調,綠梨、佛手柑、金橘,荳蔻、香菜、天竺葵,海地香根草、麂皮皮革、琥珀萃取,https://www.1976.com.tw/prod/15761
Montblanc Legend 傳奇至尊男性淡香精 TESTER,"3,700","1,380",100ml 原廠環保紙盒包裝，有瓶蓋,沈穩原木與淡雅白花的氣味，整體濃郁層次有如Dior Sauvage 與 D&amp;amp;G The One，清新暢快如Coach for Men，此香大勝傳奇EDT版本，不論是適用性、持續時間、價格、女生反應⋯，如果一生只能保留一瓶香水，我毫不猶豫會選擇它！,木質花香調 、 皮革香調,佛手柑、紫羅蘭,木質調、茉莉、木蘭花,橡苔、皮革,https://www.1976.com.tw/prod/19063
Mercedes Benz Man Intense 賓士極墨之星男性淡香水,"3,250","1,212",100ml,木質韻味深遠，持久度不錯，瓶身也很有質感。,木質調 、 辛辣調,黃葵、梨樹葉,天竺葵、橡木苔,琥珀、廣藿香、龍涎香醚,https://www.1976.com.tw/prod/18481
Prada Luna Rossa Sport 卓越非凡運動男性淡香水,"3,300","2,300",50ml,PRADA Luna Rossa Sport 卓越非凡男性淡香水，靈感來自於極限帆船賽事和美洲杯的挑戰。,東方清新調,薑、杜松子,薰衣草,香草、薰草豆,https://www.1976.com.tw/prod/14226
Dunhill Driven Blue 極限光速男性淡香水,"2,700","1,212",100ml,檸檬與青蘋果的味道撲鼻而來，略帶甜味的感覺，整體是香甜清新，適合夏天用，持香度約4~6小時，到後味慢慢變得溫和安心穩重花香，適合不浮誇or斯文的你:D,木質清新調,義大利檸檬、青蘋果、黑胡椒,杜松、橙花、鼠尾草,柚木、香根草、琥珀,https://www.1976.com.tw/prod/19549
Emporio Armani he 男性淡香水(2020版),"3,500","1,976",100ml,一種很經典、很復古的味道，帶點皮革絲綢感的木質調，絕對經典但較適合西裝熟男。,木質東方調,小荳蔻、鼠尾草、柚子,香根草,麝香、檀香、癒蒼木、雪松,https://www.1976.com.tw/prod/19921
John Varvatos Artisan Pure 工匠純淨淡香水 TESTER,"4,050","1,150",125ml 原廠環保紙盒包裝，無瓶蓋,"這瓶實在是太適合在台灣的夏天使用 , 那股清新脫俗的香味 , 有如在炎熱的夏天帶來一陣舒服的微風 , 非常適合在辦公室裡使用 , 有興趣的人可以買來試一試",草香清新調 、 柑橘清新調 、 辛辣調,西班牙檸檬、晚侖夏橙、佛手柑、苦橙葉,橙子花、咖啡樹花、茉莉花、鳶尾草、香菜子、小荳蔻,雪松、白桃花心木、白芷、麝香黃葵籽、香豆,https://www.1976.com.tw/prod/16732
YSL MYSLF 男性淡香精迷你瓶,"1,080",699,7.5ml 抹式,生命中最重要的相遇就是與自己的相遇。,木質花香調,佛手柑,橙花,龍涎香、廣藿香,https://www.1976.com.tw/prod/21203
Tom Ford Fucking Fabulous 淡香精,"13,650","8,350",50ml,這是一種香水之上的味道，一種自然界沒有的人工味道混和，讓你勾起從小到大的香水或說是味道記憶(沙龍香的藝術真諦)，是什麼味道？在人生過程中的哪時候聞過，有點似曾相識，想起人生的過往味道與記憶， 這不是香水，這是一種淡淡香香的味道，是一種自我迷戀、悶騷，自己細細品味的味道。,東方調 、 皮革香調,快樂鼠尾草、薰衣草,杏仁、香草、皮革、鳶尾根,零陵香豆、皮革、克什米爾木、琥珀、木質香,https://www.1976.com.tw/prod/17362
Montblanc Emblem 萬寶龍男性淡香水,"3,800","1,580",100ml,香味持久，有活力又沈穩的味道，有質感男性的味道，雖然用完了，但至今還找不太到比他感覺更對味的香水。,木質調,柚子、 鼠尾草,肉桂葉 、紫羅蘭葉,薰草豆、 珍貴木質香,https://www.1976.com.tw/prod/11904
Dunhill Driven 驅動覺醒男性淡香精(驅動),"2,700","1,212",100ml,買其他香水附贈小香水試管拿到的，噴下去味道幾乎跟BOSS BOTTLE自信香水一模一樣，只是BOSS的會比較甜一點，這款男人味比較重,木質花香調,酸橙、李子、佛手柑、紅蘋果,荳蔻、肉桂、茉莉、玫瑰,琥珀、香草、麝香、雪松、阿米香樹,https://www.1976.com.tw/prod/19310
Police To Be Bad Guy 雅痞男性淡香水,"2,280","1,180",125ml,大膽、古怪的個性：享受生活所提供的所有樂趣。形成鮮明對比的是一種令人陶醉的香氣。從佛手柑的波光粼粼的前調開始。新鮮，清脆的青蘋果冰糕，流淌成大膽的香草和零陵香豆慕斯，香根草和麝香的香氣以及令人陶醉的焦糖滴形成超誘人的配方。,東方調,佛手柑、薰衣草、小豆蔻、康乃馨,白花紫羅蘭、雞血石、青蘋果,廣藿香、香草、零陵香豆、麝香、焦糖,https://www.1976.com.tw/prod/18168
Mercedes Benz SIGN Your Attitude 賓士星萃男性淡香水(銀炫),"3,350","1,580",100ml,Mercedes Benz賓士星萃給人留下深刻印象的力量、強度和發射力。,木質清新調 、 柑橘調,佛手柑、柑橘、生薑,絲柏樹、薰衣草、肉豆蔻、肉桂,龍涎香、琥珀木,https://www.1976.com.tw/prod/20791
Givenchy Gentleman Reserve Privee 紀梵希紳士私享男性淡香精,"4,350","3,299",100ml,令人陶醉的威士忌風格香水，精緻的花香與深邃的木質香味相結合。這款稀有的香水融合了兩位調香大師和一位威士忌蒸餾大師的嗅覺世界和獨特技能。,威士忌、木質香調、琥珀,佛手柑,鳶尾花、栗子,,https://www.1976.com.tw/prod/21519
Hermes Eau de citron noir 愛馬仕黑檸檬中性古龍水,"5,150","3,090",100ml,非常特別的檸檬香而且是隻非常適合冬天使用的檸檬香。前調是個非常醒腦的清新檸檬味，但是沒過多久，中後調加入了木質煙燻感，使得這隻香水富有層次變化，再加上溫厚的紅茶味墊底，要外地使得這隻古龍水的持香力意外的好！,茶香清新調 、 柑橘調,黑檸檬、薰香,檸檬、紅茶,香櫞、癒創木,https://www.1976.com.tw/prod/16447
Issey Miyake Fraiche 三宅一生一生之水薄荷清新版男性淡香水,"3,600","2,150",125ml,超涼快的味道，瞬間降溫許多，像是突然躍進陽光照耀的海裡，如果正在氣頭上，倒是可以使用他來舒緩舒緩，中暑的話應該也可以緩解『我覺得我要死掉了』的想法，後面的木頭香很溫暖，不會讓你一直浸泡在冷冷的海水裡。,草香清新調 、 木質清新調,薄荷、佛手柑,紅胡椒,白廣藿香、麝香,https://www.1976.com.tw/prod/3532
Montblanc Emblem 萬寶龍男性淡香水 TESTER,"3,800","1,299",100ml 原廠紙盒包裝，無瓶蓋,基本上基調是很純粹的木質香甜甜暖暖的，給人安定成熟的感覺，適合穩重成熟的男人噴。,木質調,柚子、 鼠尾草,肉桂葉 、紫羅蘭葉,薰草豆、 珍貴木質香,https://www.1976.com.tw/prod/12163
Coach 時尚經典男性淡香水迷你瓶,600,300,4ml,一個後味很MAN很高級的氣味，男友噴了之後，整個都更加成熟帥氣的感覺，超適合開朗陽光的男生~,柑橘調,綠梨、佛手柑、金橘,荳蔻、香菜、天竺葵,海地香根草、麂皮皮革、琥珀萃取,https://www.1976.com.tw/prod/15541
Givenchy Gentleman Society 紀梵希紳士社會男性淡香精,"4,800","3,799",100ml,非常優秀的廣藿香，古典且優美，留香半永久，木質尾韻絲絲縷縷，直戳靈魂。,木質調 、 柑苔調,小荳蔻鼠尾草,水仙、海地香根草、馬達加斯加香根草,香草、檀香、雪松,https://www.1976.com.tw/prod/21514
Mercedes Benz SIGN 賓士星兆男性淡香精(星芒),"3,350","1,680",100ml,"胡椒引出的刺激，是它帶給我印象最深的開場白，一登場就要緊緊抓住你的嗅覺。隨後而來的甜味中和了激烈的前調，但它的甜是帶有神秘與層次感的：表面的甜味中帶點木質調、卻又將淡淡的辛辣感隱藏在更深層處。
秋冬的夜晚才是它的主場，適合穿著它出席重要的約會，但上班或正式場合就沒那麼恰當了。",木質東方調 、 辛辣調,危地馬拉荳蔻、紫羅蘭葉、粉紅胡椒,橙花、薰衣草、天竺葵,零陵香豆、羊絨木、廣藿香,https://www.1976.com.tw/prod/20572
YSL MYSLF 男性香精 Le Parfum,"5,200","3,250",60ml,生命中最重要的相遇就是與自己的相遇。,木質花香調 、 木質東方調,黑胡椒、苦橙葉,橙花、肉桂,香草、沉香、琥珀、木質調,https://www.1976.com.tw/prod/22033
Dior Higher Energy 高度能量男性淡香水 TESTER,"4,450","2,899",100ml 原廠環保紙盒包裝，有瓶蓋 (效期至2026.09),來自Dior專為新世紀男性刻畫的全新價值。,東方清新調,鳳梨、哈蜜瓜、杜松子、薄荷、葡萄柚,肉豆蔻、黑胡椒、薰香,勞丹脂、檀香、麝香、橡苔、香根草、雪松。,https://www.1976.com.tw/prod/9710
Givenchy Gentleman Society 紳士社會男性淡香精迷你瓶,800,390,6ml 抹式,非常優秀的廣藿香，古典且優美，留香半永久，木質尾韻絲絲縷縷，直戳靈魂。,木質調 、 柑苔調,小荳蔻鼠尾草,水仙、海地香根草、馬達加斯加香根草,香草、檀香、雪松,https://www.1976.com.tw/prod/21488
Maison Margiela By the fireplace 壁爐火光中性淡香水,"2,800","1,976",30ml,Maison Margiela的壁爐火光是Replica系列中我最喜歡的香味。香水取名恰到好處，前味給人的第一直覺就是《家有壁爐》般火光劈哩趴啦地響著，還伴隨著濃濃燃燒木頭香味，中後味給人溫暖、安定。,木質調,丁香、粉紅胡椒、橙花,栗子、瓜亞木、杜松,香草、秘魯香脂、Cashmeran,https://www.1976.com.tw/prod/19042
John Varvatos XX Artisan Teal 工匠綠馥男性淡香水,"3,220","1,150",75ml,去年已經用了一瓶了，非常清香的氣息。在炎熱的夏天使用，心情好，需要補噴，但是，如果噴在衣服上，可以更持久，一整天有清爽、乾淨的香氣陪伴，男女都適合。,柑苔調 、 海洋清新調,檸檬、迷迭香,粉紅胡椒、睡蓮,海鹽、麝香、礦物木質,https://www.1976.com.tw/prod/20361
Paco Rabanne 1 Million Royal 百萬皇家男性淡香精迷你瓶,600,380,5ml 抹式,充滿活力的薰衣草、充滿活力的雪松和感性的安息香以意想不到的方式混合在一起，讓傳奇重生，打造出一款與您一樣叛逆的香水。,木質東方調,柑橘、佛手柑、小荳蔻,紫羅蘭葉、薰衣草、鼠尾草,安息香、雪松、廣藿香,https://www.1976.com.tw/prod/21492
Jean Paul Gaultier Le Male 高堤耶裸男淡香水,"2,700","2,400",75ml,"這瓶真的是不需要太多言語去介紹它了 , 一瓶超級經典級別的男性香水 , 雖然Youtube上眾多網紅都封這瓶香水是King of Club , 但是我發現在辦公室使用它的效果也挺不錯的 , 可能台灣上班族的男性使用香水並不是非常普遍 , 所以雖然穿著正裝使用這瓶香水有一點突兀 , 但是它的經典香氣確是很受到女性同事的歡迎哦！",東方清新調,薄荷、檸檬汁,薰衣草、橙花、古明茴香,香草、麝香、珍木,https://www.1976.com.tw/prod/2910
Dior Sauvage 迪奧曠野之心男性淡香水,"3,350","2,680",60ml,柑橘調和木質調兩種調性在這款香水中被揉合得很好，強烈的龍涎香氣息佐上些許川椒的辛味，沈穩內斂的香氣又增添了一抹神秘的粗曠感，堪稱男性撲倒香！,東方清新調 、 柑橘調,卡拉布里亞佛手柑,廣藿香、川椒,龍涎香,https://www.1976.com.tw/prod/13254
YSL L'homme 天之驕子男性淡香水,"3,100","2,480",60ml,優雅且紳士，不到很陽剛硬派，而是溫柔地讓人想靠近，但倒不會到老派陳舊，令人沉醉迷戀，更是一款一年四季都適合的經典味道，推薦給斯文暖男用。,柑苔調,檸檬皮,紫羅蘭葉,黑香豆,https://www.1976.com.tw/prod/6443
Coach Blue 時尚藍調男性淡香水,"1,850",960,40ml,中味是陽光下海灘、衝浪…會撞香，以前好像adidas某款很像…蠻持久，隔天晚上睡衣還有淡淡餘香,木質清新調 、 海洋清新調,萊姆、苦艾油,黑胡椒、海洋調,琥珀、雪松,https://www.1976.com.tw/prod/18288
Hermes Eau D'orange Verte 愛馬仕橘綠之泉中性古龍水 (橙綠),"5,150","2,850",100ml,“橙綠”名副其實，青橘色的瓶身，撲鼻的鮮橙味。作為一款中性香水，鮮橙、薄荷、橡樹木香三種香味融為一體，帶來清朗活力之感。中性的氣味中，蘊含著精緻和風度，把生命的活力感和禁欲的冷色調綜合得很微妙的香水，不輕浮，適合對這世界有清晰思考和溫溫的熱愛的人。,柑橘清新調,佛手柑、 鮮橙、 檸檬,茉莉、 番木瓜、 橙花,廣藿香、 橡樹、 薄荷,https://www.1976.com.tw/prod/3278
Coach Blue 時尚藍調男性淡香水 TESTER,"3,500","1,380",100ml 原廠環保紙盒包裝，內容與正貨相同,一開始是濃郁的柑橘味，後面是甜甜的花香味。整體上從頭到味都是蠻舒服的味。適合不會討厭太顯香的人用,木質清新調 、 海洋清新調,萊姆、苦艾油,黑胡椒、海洋調,琥珀、雪松,https://www.1976.com.tw/prod/18519
John Varvatos XX Artisan Teal 工匠綠馥男性淡香水 TESTER,"4,230","1,212",125ml 原廠環保紙盒包裝，無瓶蓋,"覺得這是一款男女都適合的香水。
一開始的檸檬、迷迭香微酸味慢慢轉變鹹鹹的鹽味帶微微的粉紅胡椒、睡蓮花香，最後轉變成一種清新的麝香、礦物木質。
很乾淨、很清新、沒有侵略感讓人很有好感，特別適合想要散發陽光感的人。",柑苔調,檸檬、迷迭香,粉紅胡椒、睡蓮,海鹽、麝香、礦物木質,https://www.1976.com.tw/prod/20794
