name,original_price,special_price,specification,description,original_fragrance,top_notes,middle_notes,base_notes,detail_url,gender,fragrance,brand,ml,discount_rate,price_per_ml
Anna Sui Secret Wish 安娜苏许愿精灵女性淡香水,1900.0,850.0,30ml,ANNA SUI一直擅长操纵甜美气味的香水，而且一瓶比一瓶还精致漂亮。许愿精灵界在清新与甜美之间，有瓜果新鲜的味道，有凤梨与柠檬的热情大方，最后麝香也持香久，是相当好闻、适合春夏、接受度高的香水~,花果清新调,柠檬、哈密瓜、金盏花,凤梨、黑醋栗,琥珀、白雪松、白麝香,https://www.1976.com.tw/prod/2480,female,清新调,Anna Sui Secret Wish,30.0,55.26,28.33
Elizabeth Arden Green Tea 雅顿绿茶中性淡香水,1800.0,650.0,100ml,味道清新的绿茶味，味道没有很浓厚留香时间没有到很长，可以试著跟其他花香调的香水做叠香，我是常常把这支混著海洋调的香水做使用，或是睡前喷在床被上。,茶香清新调,大黄、佛手柑、葛缚子、橙皮、柠檬,茉莉、茴香、康乃馨、绿茶、薄荷,白琥珀、桦树苔、麝香,https://www.1976.com.tw/prod/2625,female,清新调,Elizabeth Arden Green Tea,100.0,63.89,6.5
Chanel Coco Mademoiselle Intense 香奈儿摩登魅惑印记女性淡香精,4950.0,4280.0,50ml,正如其名--魅惑，比摩登COCO更成熟一点的女郎，后调有明显的广藿香，暖热的香料味，而且比原版更持久许多。原版更适合日常和夏天。,东方花香调,西西里柑橘、卡拉布里亚佛手柑,玫瑰、茉莉花香,广藿香、琥珀、香草、顿加豆,https://www.1976.com.tw/prod/15839,female,花香调,Chanel,50.0,13.54,85.6
YSL Mon Paris 欲望巴黎女性淡香精,3300.0,2300.0,30ml,真的是很迷人...果香气十足，超级juicy，却不腻...俏皮不失优雅，贵气十足的一款好香精！,柑苔调,佛手柑、覆盆子、草莓、西洋梨,柑苔调、曼陀罗花、牡丹、茉莉,麝香、曼陀罗花、广藿香,https://www.1976.com.tw/prod/15058,female,柑橘调,YSL,30.0,30.3,76.67
Anna Sui Secret Wish 安娜苏许愿精灵女性淡香水 TESTER,2980.0,1080.0,75ml 原厂环保纸盒包装，无瓶盖,这瓶是我高中时期同学推荐给我的。许愿精灵这名字跟瓶身的样子真是符合！这瓶的香味宜人～闻起来是很舒服的味道！年轻有活力，非常适合学生使用～约会也很适合唷！,花果清新调,柠檬、哈密瓜、金盏花,凤梨、黑醋栗,琥珀、白雪松、白麝香,https://www.1976.com.tw/prod/3241,female,清新调,Anna Sui Secret Wish,75.0,63.76,14.4
Jo Malone 杏桃花与蜂蜜香水-Nectarine Blossom & Honey,2900.0,1750.0,30ml,喷上去你就是人间水蜜桃～相当还原水蜜桃清新又甜蜜的香气，但可能因为加了蜂蜜的关系，几个小时后会觉得有点太暖（一种桃子有点过熟的感觉），因此比较推荐本身体温较低或不常流汗的女生来使用。,草香清新调,黑醋栗,相思花蜜,蜜桃,https://www.1976.com.tw/prod/17487,female,清新调,Jo Malone,30.0,39.66,58.33
Prada Candy 淘心女郎女性淡香精,4750.0,2650.0,50ml 绝版收藏品,这就是焦糖爆米花的味道啊！既有个性，又甜美而温暖，而且不甜腻。就像在冷冷的冬天里，坐在沙发上盖著毛毯，吃著爆米花看电影~,诱人美食调,焦糖,白麝香鸡尾酒,寮国安息香,https://www.1976.com.tw/prod/9083,female,美食调,Prada,50.0,44.21,53.0
Dior Dune 迪奥沙丘女性淡香水,5600.0,3980.0,100ml,这瓶是朋友送给妈妈的，瓶身非常美，非常有女王的感觉，第一次闻到它让人惊艳，很强势、但又不失古典优雅风范，适合成熟女性,木质东方调,中国牡丹、百合、香萝兰,香水树、茉莉花,金雀花、地衣、龙涎香,https://www.1976.com.tw/prod/2586,female,木质调,Dior,100.0,28.93,39.8
Narciso Rodriguez Fleur Musc 桃色优雅女性淡香精,3750.0,2180.0,50ml,这品牌的经典款桃色优雅，令人印象深刻的是暖暖的木质感玫瑰花香，适合沈稳女性工作场合使用的办公香，安全且不雷,玫瑰花香调,粉红胡椒,玫瑰、牡丹、麝香,广藿香、琥珀、紫萝兰花,https://www.1976.com.tw/prod/15097,female,花香调,Narciso Rodriguez Fleur Musc,50.0,41.87,43.6
YSL MON PARIS 圣罗兰欲望巴黎女性淡香精 TESTER,6800.0,3400.0,90ml 原厂环保纸盒包装，有瓶盖,曾经被男性友人夸赞很有质感的香甜味，适合年纪轻的女孩也适合轻熟女，是我最爱的一瓶香水,柑苔调,佛手柑、覆盆子、草莓、西洋梨,柑苔调、曼陀罗花、牡丹、茉莉,麝香、曼陀罗花、广藿香,https://www.1976.com.tw/prod/17932,female,柑橘调,YSL,90.0,50.0,37.78
Tous Touch 金色小熊女性淡香水,2550.0,1650.0,100ml 无仿古皮革的小袋子,充满手作感的瓶身设计，让人拿在手上就有温润的触感。甜暖的蜜香，真的是熊熊的最爱耶。,花香调,百合、香雪兰、荷花香,阿拉伯茉莉、桂花、大溪地栀子花,覆盆子、杏仁、蜂蜜、香子兰,https://www.1976.com.tw/prod/4655,female,花香调,Tous Touch,100.0,35.29,16.5
Coach 时尚经典女性淡香水,2000.0,999.0,30ml,这款是我看了很多人推荐之下盲购，喷在身上有种甜滋滋的幸福感！自从在1976买香水之后，就开始喜欢尝试不同品牌的香味水，coach这款香水是我觉得可以推荐给喜欢花果香调的年轻女孩的一款小香～～,玫瑰花香调,梨、义大利柑橘精油、粉红葡萄柚、荔枝,白阿尔巴玫瑰、Mahonial™、保加利亚玫瑰精油、双瓣茉莉,白雪松、麝香、檀香、橡树苔,https://www.1976.com.tw/prod/14475,female,花香调,Coach,30.0,50.05,33.3
Narciso Rodriguez Fleur Musc 桃色优雅女性淡香精迷你瓶,1000.0,450.0,7.5ml 抹式，无盒装,这品牌的经典款桃色优雅，令人印象深刻的是暖暖的木质感玫瑰花香，适合沈稳女性工作场合使用的办公香，安全且不雷,玫瑰花香调,粉红胡椒,玫瑰、牡丹、麝香,广藿香、琥珀、紫萝兰花,https://www.1976.com.tw/prod/21832,female,花香调,Narciso Rodriguez Fleur Musc,7.5,55.0,60.0
Anna Sui Flight of Fancy 逐梦翎雀女性淡香水,2650.0,1280.0,50ml,Anna Sui的香水，真的都好适合收藏哦！每一款的瓶身都很梦幻~ 这款的香味是果香中带点甜美，但却又甜而不腻，很适合当入门香哦！,花果清新调,日本蜜柚、爪哇柠檬、荔枝,玫瑰花、星木兰、紫苍兰,白麝香、安息香、云杉,https://www.1976.com.tw/prod/4507,female,清新调,Anna Sui Flight,50.0,51.7,25.6
Calvin Klein CK Beauty 雅致女性淡香精,3600.0,1250.0,100ml,看似简单的前、中、后味，但确是一瓶有层次、有厚度的味道，淡雅的黄葵子引出醇厚的茉莉花香，茉莉花香醇厚持久但不会让人感到俗气，渐渐混合后味的沉稳杉木味，又带出另一种木质花香调的风采。,木质花香调,黄葵子,茉莉花,杉木,https://www.1976.com.tw/prod/8145,female,木质调,Calvin Klein,100.0,65.28,12.5
Givenchy EauDemoiselle Eau Florale 纪梵希宫廷玉露浪漫玫瑰女性淡香水,4580.0,3080.0,100ml (2025新包装),"第一次闻觉得像是女生刚洗完澡出来很舒服的皂香味道,但喷几次后,觉得是玫瑰香调但又多了果香,是花香果香很平衡的香味,清新风的偏甜,但不会腻,喜欢玫瑰又不喜欢太成熟,这支很适合",玫瑰花香调,西洋梨、水茉莉,野玫瑰,白木香树,https://www.1976.com.tw/prod/11561,female,花香调,Givenchy,100.0,32.75,30.8
Coach 时尚经典女性淡香水 TESTER,3950.0,1380.0,90ml 原厂环保纸盒包装，内容与正货相同,这瓶的味道是玫瑰混合茉莉花的清香气息，完全没有俗丽的脂粉味。跟Chloe 的白玫瑰很类似，但又多了一点淡淡荔枝果香味道的层次感。90ml已用第三罐。,玫瑰花香调,梨、义大利柑橘精油、粉红葡萄柚、荔枝,白阿尔巴玫瑰、Mahonial™、保加利亚玫瑰精油、双瓣茉莉,白雪松、麝香、檀香、橡树苔,https://www.1976.com.tw/prod/14687,female,花香调,Coach,90.0,65.06,15.33
Elizabeth Arden Green Tea Lotus 雅顿绿茶莲花限量淡香水,1800.0,660.0,100ml,最近开始又喜欢绿茶香，基底的绿茶加上花香有意想不到的和谐！绿茶让花香变得清新脱俗，CP值很高的一款淡香，这款值得收藏！,茶香清新调,紫梅、樱花、柚子,桃花木、莲花、绿茶、桂花,麝香、白桦,https://www.1976.com.tw/prod/7379,female,清新调,Elizabeth Arden Green Tea Lotus,100.0,63.33,6.6
Chanel Coco Mademoiselle 香奈儿摩登女性淡香精版本,4950.0,4200.0,50ml,摩登COCO是我一闻就爱上的香，她不像香奈儿5号那么抢眼，又不像chance系列的粉红泡泡那样低调，刚刚好的花香很有气质，像大家闺秀~~舍不得穿呢！,东方花香调,香橙、橘子、橙花、香柠檬,含羞草、茉莉、土耳其玫瑰、依兰,零陵香豆、广藿香、芳香树脂、香草、香根草、白麝香,https://www.1976.com.tw/prod/15127,female,花香调,Chanel,50.0,15.15,84.0
Calvin Klein CK Sheer Beauty 纯净雅致女性淡香水,3600.0,1099.0,100ml 粉盒,原以为......这款香水会有甜到不行的蜜桃味，但嗔了几下，发觉它充满著淡淡的蜜桃味，是非常舒服的味道!!,花果清新调,红莓、水蜜桃贝里尼酒、佛手柑,粉红百合、茉莉、牡丹,麝香、檀香,https://www.1976.com.tw/prod/9426,female,清新调,Calvin Klein,100.0,69.47,10.99
Coach 时尚经典女性淡香水迷你瓶,600.0,290.0,4.5ml 抹式,好喜欢这种温暖又带有优雅香味的感觉，居然是年轻的超杀女代言的 :)很舒服的感受，喷上一些觉得整个人好有气质(呵)又有精神起来啰 !!,玫瑰花香调,梨、义大利柑橘精油、粉红葡萄柚、荔枝,白阿尔巴玫瑰、Mahonial™、保加利亚玫瑰精油、双瓣茉莉,白雪松、麝香、檀香、橡树苔,https://www.1976.com.tw/prod/14599,female,花香调,Coach,4.5,51.67,64.44
Clean Warm Cotton 温暖棉花女性淡香精香水笔,580.0,300.0,5ml 抹式,,花果清新调,柑橘、马鞭草,棉花、橙花、果香、海洋,麝香、琥珀,https://www.1976.com.tw/prod/18281,female,清新调,Clean Warm Cotton,5.0,48.28,60.0
Diptyque Eau Rose 玫瑰之水女性淡香水,4000.0,3200.0,50ml,真的很喜欢这款，玫瑰调性的香水通常会显得比较有锋芒，比较艳丽，但玫瑰之水揉合了荔枝的甜腻，带出了一种活泼俏皮感，让这款香水不会显得太过自以为是的高雅，反而有种甜香调皮又带点女人味的反差感❤️,玫瑰花香调,香柠檬、黑醋栗、荔枝,茉莉、天竺葵、玫瑰,麝香、弗吉尼亚雪松、白蜂蜜,https://www.1976.com.tw/prod/16233,female,花香调,Diptyque,50.0,20.0,64.0
Marc Jacobs Daisy 小雏菊女性淡香水,3900.0,1560.0,50ml,前味的野生草莓、粉红葡萄柚带来清甜的气息，中后味搭配有温暖的感觉，算是阳光气质少女的香，持香度不久，偶尔须补香，不过喷量还是要轻些避免太浓郁~,花香调,紫罗兰叶、野生草莓、粉红葡萄柚,栀子花、茉莉花、紫罗兰,麝香、香草、珍木,https://www.1976.com.tw/prod/4546,female,花香调,Marc Jacobs,50.0,60.0,31.2
Paco Rabanne Lady Million Eau My Gold 百万千金女性淡香水,2100.0,1212.0,30ml,蜂蜜与葡萄柚综合起来，犹如香甜的果汁，几分钟后，中味转为花香调，像是百万千金天生独特的一点点任性，一点点自我。奢花的香味中，仍然不失俏皮与时尚感，后味的雪松香可以持续很久很久，虽然淡香水，能有这样的持久度算非常优异。,柑橘花香调,芒果、新鲜葡萄柚,紫罗兰叶、橙花,雪松、琥珀香、麝香,https://www.1976.com.tw/prod/12013,female,柑橘调,Paco Rabanne Lady Million Eau My Gold,30.0,42.29,40.4
Marc Jacobs Daisy 小雏菊女性淡香水 TESTER,5050.0,1680.0,100ml 原厂环保纸盒包装，有瓶盖,今天收到香水了，第一瓶Marc Jacobs的香水，瓶子真的超级可爱，而且真的好香喔!!! 是那种花香，可是又不会太腻，夏天喷也不会太晕，很有春天的气息，下次想再试试轻甜雏菊。,花香调,紫罗兰叶、野生草莓、粉红葡萄柚,栀子花、茉莉花、紫罗兰,麝香、香草、珍木,https://www.1976.com.tw/prod/7172,female,花香调,Marc Jacobs,100.0,66.73,16.8
Coach 时尚经典女性淡香精版本,2100.0,999.0,30ml,味道其实很像某一专柜的玫瑰护手霜，味道如其名，真的是经典的香味，如果有刚接触香水的女生，这罐其实很适合，不太会失误!,玫瑰花香调,覆盆子、水梨、粉红胡椒,土耳其玫瑰、栀子花,麂皮麝香、喀什米尔木、檀香,https://www.1976.com.tw/prod/15465,female,花香调,Coach,30.0,52.43,33.3
Coach 时尚经典女性淡香精版本 TESTER,3950.0,1212.0,90ml 原厂环保纸盒包装，内容与正货相同,偏成熟的花香，后味蛮甜美，比较适合25以上的女性，浓郁却很好闻，还有一点果香甜甜的，成熟中的可爱。,玫瑰花香调,覆盆子、水梨、粉红胡椒,土耳其玫瑰、栀子花,麂皮麝香、喀什米尔木、檀香,https://www.1976.com.tw/prod/14796,female,花香调,Coach,90.0,69.32,13.47
Marc Jacobs Daisy 小雏菊女性淡香水迷你瓶,800.0,370.0,4ml,初次接触香水 也就是大姊喜爱的Marc Jacobs Daisy 回味时带股清新别于风俗的香氛 尤其瓶身设计 大方 脱俗 仿佛置身在小花园里的白洋装女孩而身旁幻蝶群情飞舞 由浓郁甜美的的前调转成其次中调舒服的气息 融合后味 珍木 香草 麝香令人难忘 记忆起来还真令姊妹俩陶醉不已,花香调,紫罗兰叶、野生草莓、粉红葡萄柚,栀子花、茉莉花、紫罗兰,麝香、香草、珍木,https://www.1976.com.tw/prod/5123,female,花香调,Marc Jacobs,4.0,53.75,92.5
Penhaligon's The Favourite 潘海利根女王的耳语淡香精,7300.0,5350.0,100ml,一喷上手腕就闻到酸甜多汁的柑橘和柠檬味，不久混合中味鸢尾花的粉感后，竟然有股柠檬蛋糕的香气～随著后调出现，转为柔和的木质调。非常优雅有气质的一款香！,木质花香调,柑橘、紫罗兰、小苍兰,含羞草、鸢尾、茉莉,麝香、降龙涎香醚、檀香,https://www.1976.com.tw/prod/19185,female,木质调,Penhaligon's,100.0,26.71,53.5
Prada La Femme 女性淡香精,4750.0,2850.0,50ml,这是款适合秋冬的香水～气温高时穿觉得有些腻秋天寒流来时再穿上她，突然就爱上了！有种被包覆起来的温暖感柔柔的感觉～ 多喷几下也没有厚重感～时不时会去闻闻手臂的香味～有种温柔小姐姐的感觉❤️,东方花香调,香料、蜂蜡,鸡蛋花、鸢尾花、伊兰、晚香玉,香根草、香草,https://www.1976.com.tw/prod/15166,female,花香调,Prada,50.0,40.0,57.0
Jo Malone 黑石榴香水-Pomegranate Noir,2800.0,1599.0,30ml,曾经在路上闻到一丝神秘的香味，觉得很熟悉但又想不起来，当下脑中浮现的形象是一个漂亮有气质又有个性的美女，只是当时是晚上的街上，遍寻不著香味本人，回家闻一轮柜子的香水，才发现是这罐黑石榴！ 当初自己闻的时候觉得不起眼，没想到从别人身上散发的是这么强的气场,木质调,红石榴、覆盆子、李子,粉红胡椒、香水百合,辛辣木香,https://www.1976.com.tw/prod/17623,female,木质调,Jo Malone,30.0,42.89,53.3
Chanel Coco Mademoiselle 香奈儿摩登女性淡香水,3950.0,3180.0,50ml,第一次接触到这瓶香水的时候是二十出头就爱上了这个香味，一开始喷味道比较呛浓，可是到了中后味时就会散发出成熟又甜甜的味道，只喷一点就超持久的，不过切记不要喷太多，一点点就超香超持久的！,东方花香调,葡萄柚、荔枝,玫瑰、茉莉,广藿香、香根草、香草、白麝香,https://www.1976.com.tw/prod/3079,female,花香调,Chanel,50.0,19.49,63.6
Anna Sui Fantasia Rose 玫瑰花舞独角兽淡香水,1900.0,950.0,30ml,Anna Sui是我25岁左右热爱的品牌，青春、梦话、华丽、可爱的包装，我对充满甜腻的Anna Suii改观，这罐的玫瑰花不明显，反而是玫瑰天竺葵与玫瑰草的香气，清新加一点个性，适合青春女孩。,木质花香调,黄葵、佛手柑、野莓,玫瑰、水生调、天竺葵,琥珀木、香根草、麝香,https://www.1976.com.tw/prod/21700,female,木质调,Anna Sui Fantasia Rose,30.0,50.0,31.67
Carolina Herrera 212 VIP 女性淡香精,4650.0,2380.0,80ml,我用这瓶用了3年了，这真的是我喷过最爱的香水! 无论身旁人抽多少多中的烟身上依然香香的!!! 只是刚喷真的挺浓的啦~后味甜甜的好喜欢好舒服~,诱人美食调,莱姆酒、百香果,麝香、栀子花,香草、薰草豆,https://www.1976.com.tw/prod/8049,female,美食调,Carolina Herrera,80.0,48.82,29.75
Coach Floral 芙洛丽女性淡香精,2100.0,1050.0,30ml 无玫瑰金吊牌,柑橘和凤梨替这支香水开启了序幕，使它带著热带风情。接著玫瑰茶的香味和茉莉交织在一起，让它多了几分婉约优雅。整体来说是甜美温柔的一款~四季都适合使用喔。,花果甜美调,柑橘、凤梨,茶香玫瑰、双瓣茉莉、栀子花,水晶麝香、奶油木、广藿香,https://www.1976.com.tw/prod/15833,female,果香调,Coach,30.0,50.0,35.0
Marc Jacobs Daisy Eau So Fresh 清甜雏菊女性淡香水,2750.0,1350.0,30ml,daisy系列应该可以说是marc jacobs最有名的了。 这瓶可以说是比「小雏菊」更适合夏天，与另一半外出约会时穿上的一瓶香水。多了点女孩的甜美成分，却不失特别的味道。 后味不会因为夏天的温度而变调，反而更融入深刻。 已经成为夏天的定番款了！！！,花香调,覆盆莓、红葡萄柚、青翠绿叶、洋梨,紫萝兰、野生玫瑰、苹果花、荔枝、茉莉花瓣,麝香、梅子、雪松,https://www.1976.com.tw/prod/8381,female,花香调,Marc Jacobs,30.0,50.91,45.0
Marc Jacobs Daisy Eau So Fresh 清甜雏菊女性淡香水TESTER,5150.0,1650.0,125ml 原厂环保纸盒包装，有瓶盖,一开始是Marc jacobs的脑粉，原本以为味道会像服装设计一样比较个性俏皮感，不过这款香水可爱的女孩感很强，就是香甜但又不会太多，感觉上班上课都很适合大学不挑场合！,花果清新调,覆盆莓、红葡萄柚、青翠绿叶、洋梨,紫萝兰、野生玫瑰、苹果花、荔枝、茉莉花瓣,麝香、梅子、雪松,https://www.1976.com.tw/prod/9063,female,清新调,Marc Jacobs,125.0,67.96,13.2
Coach Floral 芙洛丽女性淡香精 TESTER,4150.0,1450.0,90ml 原厂环保纸盒包装，内容与正货相同,闻到这款香水的味道，我仿佛看到一个活泼洋溢的小女孩在灿烈阳光下欢笑著，是的，这款香水的味道偏甜，像果糖、像水果、像某种酸酸甜甜的糖果，让人闻了不禁莞尔一笑，尤其是喜爱甜味的香水的人，都会加购这瓶香水当收藏品。花香带果香，很适合学生族群，或刚出社会的小资女，或喜欢甜味香水的女性，不论跟姐妹淘逛街喝下午茶，跟男友看电影约会，或上课考试，都很适合喷上这款香水。,花果甜美调,柑橘、凤梨,茶香玫瑰、双瓣茉莉、栀子花,水晶麝香、奶油木、广藿香,https://www.1976.com.tw/prod/16177,female,果香调,Coach,90.0,65.06,16.11
Tous L'Eau 水语花香女性淡香精,3150.0,1450.0,90ml (粉红色外盒),开头的柑橘柠檬并不容易发觉，中味给人感觉十分淡雅；后味的木质香不知为何带一点清凉感，也有我喜欢的琥珀。整体来说是有气质、甚至是让我脑中浮现”灵气”二字的香味，适合微凉初秋的心境。,木质花香调,柑橘、综合花香、柠檬,小苍兰、茉莉、黑醋栗、白牡丹,白麝香、广藿香、琥珀,https://www.1976.com.tw/prod/9418,female,木质调,Tous,90.0,53.97,16.11
Chanel Coco Noir 香奈儿黑色可可女性淡香精,4950.0,4200.0,50ml 淡香精,柑橘调在任何季节都非常适合，不刺鼻不浓郁，刚刚好的气质，刚刚好的时尚，给你一种高贵但又容易亲近的感觉。味道很持香，很有吸引力的女香。,柑橘花香调,葡萄柚、佛手柑,玫瑰、茉莉花、水仙、天竺葵叶,陵兰香豆、印尼广藿香、檀香、香草、白麝香乳香,https://www.1976.com.tw/prod/10863,female,柑橘调,Chanel,50.0,15.15,84.0
YSL Mon Paris Parfum Floral 欲望巴黎淡香精-星木兰版,4950.0,2970.0,50ml 绝版收藏品 2019.09出厂 便宜卖,这罐味道真的很讨喜～虽然缎带系列味道都很相似，不过最后我还是选择星木兰这瓶～闻起来甜甜的但也不致于让人觉得过头，很适合上班或上课时稍微点缀一下自己！,玫瑰花香调,佛手柑、梨子、覆盆子、桃子,曼陀罗、双瓣茉莉、橙花、星木兰、牡丹,广藿香、麝香,https://www.1976.com.tw/prod/17007,female,花香调,YSL,50.0,40.0,59.4
Coach Floral 芙洛丽女性淡香精迷你瓶,600.0,300.0,4.5ml,很好闻的花香，喜欢都花香的朋友可选这瓶，但味道不会觉得是成熟的，经典的coash吊牌设计很适合收藏，味道很时尚不俗气，很推荐,花果甜美调,柑橘、凤梨,茶香玫瑰、双瓣茉莉、栀子花,水晶麝香、奶油木、广藿香,https://www.1976.com.tw/prod/15848,female,果香调,Coach,4.5,50.0,66.67
Jo Malone 橙花香水-Orange Blossom,2800.0,1750.0,30ml,以前最爱JM家的罗勒橙花，停产之后发现这支，最爱的宝座直接换人当，丁香花跟香根草让这支花香变得沉稳，加入荷花跟橙花多了一丝明亮的水气感，像在溪边的感觉。虽然留言都说适合女生但我觉得这支是男生用起来也是超有魅力的中性香。,柑橘花香调,克莱门汀花、丁香,橙花、荷花,鸢尾花、香根草,https://www.1976.com.tw/prod/17235,female,柑橘调,Jo Malone,30.0,37.5,58.33
Calvin Klein ck Truth 真实女性淡香精,3800.0,1680.0,100ml,"层次感非常丰富的一款香水, 每个阶段的味道都很独特, 尤其最末那股馥郁琥珀香, 一直萦绕在周围....是一款很特别又耐人寻味的香氛, 我很喜欢!!",木质花香调,竹子、芍药、竹子、佛手柚,合欢花、香子兰野玫瑰、丝树花,白琥珀、香木、白麝香,https://www.1976.com.tw/prod/4315,female,木质调,Calvin Klein,100.0,55.79,16.8
Marc Jacobs Daisy Dream 雏菊之梦女性淡香水,2750.0,1212.0,30ml 银色圆盖,终于首次尝试网路上一片好评的雏菊之梦，味道活泼可爱，一开始甜甜味道比较浓，到了后味是非常气质的白木香十分清爽，是一款适合女孩们(学生或上班族)的香味喔!,花果清新调,黑莓果、葡萄柚、水梨,茉莉花、荔枝、紫藤花,白木香、麝香、椰子汁,https://www.1976.com.tw/prod/11923,female,清新调,Marc Jacobs,30.0,55.93,40.4
Coach Floral Blush 嫣红芙洛丽女性淡香精,1950.0,950.0,30ml,甜美花果香，适合夏日风情，味道偏甜，适合搭配衬衫、牛仔裤或者连身裙，再配上一顶草帽，持久度尚可，需要补香，是款年轻的香水,木质花香调,枸杞莓、葡萄柚,牡丹、水蜜桃,白松木、麝香,https://www.1976.com.tw/prod/17134,female,木质调,Coach,30.0,51.28,31.67
Nina Ricci L'Air du Temps 比翼双飞女性淡香精,3280.0,2250.0,100ml 淡香水,第一次喜欢上老香。容易穿，不甜，不妖艳，不挑季节场合，重点是气质大大加分。清香高雅，比翼双飞适合年轻气质美女，不亏是经典老香水。,木质花香调,佛手柑、桃子、橙花油、紫檀,茉莉、兰花、康乃馨、鸢尾草,安息香、檀香、西洋杉、琥珀、白麝香,https://www.1976.com.tw/prod/3140,female,木质调,Nina Ricci,100.0,31.4,22.5
YSL Mon Paris Intensement 欲望巴黎馥郁版女性淡香精(花耀),6800.0,4080.0,90ml,香甜的味道，持久的味道，相当让人上瘾。特别喜欢这种花香与香草的搭配，就像甜点般却不腻口，重要场合不会错，日常小性感也可以！,玫瑰花香调,佛手柑、梨子、覆盆子、黑醋栗、橙,曼陀罗、五月玫瑰、保加利亚玫瑰、牡丹、小苍兰,喀什米尔木麝香、广藿香、安息香、白麝香、香草,https://www.1976.com.tw/prod/18095,female,花香调,YSL,90.0,40.0,45.33
Nina Ricci L'Air du Temps 比翼双飞女性香水TESTER,3280.0,1450.0,100ml 原厂环保纸盒包装，有瓶盖,高中时期开始接触香水，大家都是先偷喷妈妈化妆台上的嫁妆~结果大撞香。每个妈妈好像都有一瓶比翼双飞，果然是二战后的老古董。也就是那个时代的女性缩影，温柔坚毅好妈妈。,木质花香调,佛手柑、桃子、橙花油、紫檀,茉莉、兰花、康乃馨、鸢尾草,安息香、檀香、西洋杉、琥珀、白麝香,https://www.1976.com.tw/prod/4009,female,木质调,Nina Ricci,100.0,55.79,14.5
Marc Jacobs Daisy Dream 雏菊之梦女性淡香水 TESTER,5050.0,1600.0,100ml 原厂环保纸盒包装，无瓶盖,【*2021年已重新设计瓶身，瓶盖皆无花朵喔】这款是我第一罐大容量的香水，买了一年也要见底了，真的是久闻不腻，即将要入手第二瓶，这款的味道让人感到幸褔，很适合睡前拥有的味道，会让人甜甜的很舒服。,花香调,黑莓果、葡萄柚、水梨,茉莉花、荔枝、紫藤花,白木香、麝香、椰子汁,https://www.1976.com.tw/prod/12135,female,花香调,Marc Jacobs,100.0,68.32,16.0
