name,original_price,special_price,specification,description,fragrance,top_notes,middle_notes,base_notes,detail_url
Montblanc Explorer 萬寶龍探尋旅者男性淡香精,"2,150","1,050",30ml,"味道相似Creed Aventus, ARMAF Club De Nuit Intense, Lamborghini Invincibile Tonino 以及後調的Mercedes Benz Select，味道整體有煙燻的木質感(龍涎香醚與木質香)，男人味十足，四季皆宜。MONTBLANC EXPLORER瓶子設計裡外充滿該品牌特色標誌，如果是萬寶龍愛好者很值得買來收藏。",,佛手柑,香根草,廣藿香,https://www.1976.com.tw/prod/16755
Montblanc Explorer 萬寶龍探尋旅者男性淡香精 TESTER,"3,900","1,499",100ml 原廠環保紙盒包裝，有瓶蓋,屬於清新有質感的男香，非常耐聞，是四季皆宜的味道，偏中性打扮或是別有個性的女生也很適合。,木質調 、 皮革香調,佛手柑,香根草,廣藿香,https://www.1976.com.tw/prod/17029
Burberry Hero 英雄神話男性香精 Parfum 迷你瓶,800,450,5ml 抹式,Burberry Hero 英雄神話男性香精 Parfum 以三重雪松詮釋木質調的渾厚悠遠，碰撞柔軟恬靜的阿米香樹芳香，迸發勃勃生機；添以沉靜莎草精油收就怡人尾香。,木質調,阿米香樹,阿特拉斯雪松、喜馬拉雅雪松、維吉尼亞雪松,莎草,https://www.1976.com.tw/prod/21796
Giorgio Armani Acqua di Gio 亞曼尼寄情水男性淡香水迷你瓶,800,450,5ml 抹式 效期至2026.11,溫和清新的香味雖然是男香但這帶點甜味，非常經典的一罐香水，味道雖然不會太陽剛，但是依然讓人有種穩重有肩膀的感覺。,木質花香調,卡拉布里亞佛手柑、橙花、綠橘,海洋調、茉莉花、 風信子、 岩玫瑰、迷迭香、柿子,麝香、廣藿香、雪松,https://www.1976.com.tw/prod/23104
【身體系列】Carolina Herrera 212 MEN都會男性香水體香膏,"1,000",880,75ml,,,,,,https://www.1976.com.tw/prod/2871
Hermes Terre D'hermes Eau Intense Vetiver 愛馬仕大地馥郁香根草男性淡香精,"3,860","2,320",50ml,10多年前至今使用N瓶了，木質香中的“毒藥”！所以回不去了,木質調 、 辛辣調,葡萄柚、佛手柑、檸檬,天竺葵、四川花椒,琥珀、廣藿香、香根草、乳香,https://www.1976.com.tw/prod/16490
Gucci Guilty pour Homme 罪愛男性淡香水,"3,250","1,790",50ml,由Chris Evans代言真的太適合了，活力十足的一款香水， 先用果香帶出青春氣息，再以辛香入中味，最後由木質調做延續， 非常適合都會男性的性質喔!,木質清新調,綠葉、橘子、樹汁、粉紅胡椒、義大利檸檬,橙花、薰衣草、荳蔻,廣藿香、琥珀、檀木、香柏,https://www.1976.com.tw/prod/8723
Dolce & Gabbana K Intense 王者之心極致男性淡香精,"5,100","2,650",100ml,上蓋搶眼的銀色王冠，前味香調是藏紅花蔓延，佐以中間的無花果，後味的皮革很持久。,木質調 、 皮革香調,藏紅花,無花果,皮革,https://www.1976.com.tw/prod/22864
Gucci Guilty pour Homme 罪愛男性淡香水 TESTER,"4,500","2,050",90ml 原廠環保紙盒包裝，有瓶蓋,之前聽朋友推薦之下買這罐送男友當情人節禮物，男友超級愛不釋手！！！！,木質清新調,綠葉、橘子、樹汁、粉紅胡椒、義大利檸檬,橙花、薰衣草、荳蔻,廣藿香、琥珀、檀木、香柏,https://www.1976.com.tw/prod/9305
Hermes Eau Intense Vetiver 愛馬仕大地馥郁香根草男性淡香精 TESTER,"5,200","2,600",100ml 原廠環保紙盒包裝，內容與正貨相同,香根草及四川花椒的辛辣氣息，為原版大地增添了成熟內斂的氣質，而檸檬及葡萄柚的清香，還有廣藿香及琥珀的沉穩，都是延續著原版大地的經典，又是支讓人著迷的香氣。,木質調 、 辛辣調,葡萄柚、佛手柑、檸檬,天竺葵、四川花椒,琥珀、廣藿香、香根草、乳香,https://www.1976.com.tw/prod/17603
Montblanc Explorer 萬寶龍探尋旅者男性淡香精迷你瓶,600,280,4.5ml,Opening 剛開始噴的前面有明顯柑橘的酸，乾淨，非常適合夏天，就算流汗後也與此款香水非常融化。由於後味會轉換成時髦的皮革味，所以也很合適在辦公室的男士使用。,,佛手柑,香根草,廣藿香,https://www.1976.com.tw/prod/16775
Salvatore Ferragamo Subtil 藍色經典男性淡香水,"2,900","1,450",100ml,拿到的時候一開始覺得漸層藍色瓶子很漂亮，瓶子控可以收藏，前味的薑及小豆蔻明顯蓋掉橘子的果味，而且味道頗衝有點類似胡椒的感覺，中味有股淡淡的花香做承接，到後味滿舒服的就是海洋味的皂感，對胡椒、辣椒的味道會暈香的可以先去試香幾次再考慮，整體來說是一款滿清新的香水，滿適合夏天以及上班族使用,花香調 、 海洋清新調,橘香、蓮葉、小豆蔻、薑,芫荽、紅玫瑰、紫羅蘭,廣藿香、乾琥珀、麝香,https://www.1976.com.tw/prod/2670
Versace Oud Noir 男性淡香精,"4,950","2,680",100ml,衝擊性頗強的烈酒、皮革、木質感，有點微微聯想到YSL的天之驕子夜幕版，但沒有那麼重的甜味和煙燻烏梅感，是木質及皮革感占比較大的沉穩感受。需要些年紀、歷練、厚重的冬裝、沒有陽光的夜幕去支撐，非常適合不那麼外放的熟男使用,木質調 、 皮革香調 、 辛辣調,黑胡椒、酸橙、橙花,藏紅花、荳蔻、乳香,沉香、廣藿香、皮革,https://www.1976.com.tw/prod/14828
Burberry Hero Parfum Intense 英雄神話極蘊男性香精,"4,950","2,980",50ml,"適合春夏的一款皮革香，
就像英姿颯爽的神秘帥哥👸
前味先是有點冷淡的雪松
但是中後味轉變成穿著皮衣的暖男香
是一款滿舒服不刺鼻的男香🥰",木質調 、 皮革香調 、 辛辣調,黑胡椒,皮革,雪松,https://www.1976.com.tw/prod/22809
Guerlain L'homme Ideal 男性淡香水,"4,500","2,700",100ml,有杏仁跟甜酒的香味，很適合秋冬非常耐聞，沒有攻擊性幾乎讓人失去戒心的味道,木質東方調 、 皮革香調,柑橘、迷迭香、橙花、苦橙,杏仁、零陵香豆,皮革、雪松、香根草,https://www.1976.com.tw/prod/17792
Dolce & Gabbana K Parfum 王者男性香精,"6,230","3,050",100ml,Dolce & Gabbana K Parfum 王者男性香精，以無花果、焦糖濃郁的奶香氣息為旅程拉開序幕；中調加入大膽而有趣的甘草，最後透過深邃感性的木質基調與檀香，整體香調令人流連忘返，表達男性強烈而誘人的男性魅力。,木質調 、 誘人美食調 、 辛辣調,無花果、焦糖,甘草,檀香和木質調,https://www.1976.com.tw/prod/22876
Dior Dune 迪奧沙丘男性淡香水 TESTER,"4,450","2,899",100ml 原廠環保紙盒包裝，內容與正貨相同,,海洋清新調,,,,https://www.1976.com.tw/prod/9708
Guerlain L'homme Ideal 男性淡香水 TESTER,"4,500","2,250",100ml 原廠環保紙盒包裝，有瓶蓋,這款香水的味道有點像柑橘，之後變成了淡淡的皮革/杏仁味，它是一款非常男性化又不失優雅的香水。,木質東方調,柑橘、迷迭香、橙花、苦橙,杏仁、零陵香豆,皮革、雪松、香根草,https://www.1976.com.tw/prod/19196
Hermes Eau Intense Vetiver 愛馬仕大地馥郁香根草男性淡香精補充裝 TESTER,"5,200","2,950",125ml 原廠環保紙盒包裝，有瓶蓋,"秋冬必噴無腦香，前調帶點又圓潤又微微的辛辣木質果香感，後調木質感出現搭配著前中調的層次真的絕了！
不會太有距離但又不失格局，持香度也是蠻厲害持久，噴在織物上的效果更是不用說！真的超推",木質調 、 辛辣調,葡萄柚、佛手柑、檸檬,天竺葵、四川花椒,琥珀、廣藿香、香根草、乳香,https://www.1976.com.tw/prod/22799
Burberry Hero Parfum Intense 英雄神話極蘊男性香精迷你瓶,800,390,5ml 抹式,皮革氣味聞起來很乾淨，持久耐用！乾燥後會散發出柔和而略帶甜味的木質香味。,木質調 、 皮革香調 、 辛辣調,黑胡椒,皮革,雪松,https://www.1976.com.tw/prod/22550
【身體系列】Giorgio Armani 亞曼尼寄情水男性體香膏,"1,550",999,75g,熱門香.果然是如其名一般˙寄情水...清雅味...適合每個男人..˙,木質花香調,,,,https://www.1976.com.tw/prod/17835
Giorgio Armani Acqua di Gio 亞曼尼寄情水男性淡香精版本,"3,300","2,150",30ml,它散發著一種極具吸引力的香氣，獨特的調香帶來一種深沉、成熟的氛圍，這款淡香精的持久力令我驚艷，一整天都能感受到微妙而持久的香氣，而不會讓人感到過於壓倒性。香調的平衡恰到好處，開始時散發出清新的前味，隨著時間推移，淡雅的中味展現出品味獨特的一面，最終轉化為深沉的基調，為整體香氣增添了層次感，給人一種成熟、優雅的感覺，是一款適合多種場合的香水。,礦物香調、香根草、廣藿香,海洋調、青柑橘,快樂鼠尾草、天竺葵、薰衣草,,https://www.1976.com.tw/prod/21087
Hermes Eau Intense Vetiver 愛馬仕大地馥郁香根草男性淡香精迷你瓶,"1,200",860,12.5ml 噴式,清香木質調香味，檸檬，葡萄柚，天竺葵的夏天清爽氛圍，搭配淡淡木質調，不會有過濃的木頭沉重刺激感。女生也適合的淡雅森林氣質香，十分文青喔！,木質調 、 辛辣調,葡萄柚、佛手柑、檸檬,天竺葵、四川花椒,琥珀、廣藿香、香根草、乳香,https://www.1976.com.tw/prod/16890
Dior Fahrenheit 迪奧華氏溫度男性淡香水,"3,300","2,600",50ml,喜歡皮革味的人，這款絕對不容錯過 ，是經典皮革香。剛開始前味混雜帶有肉豆蔻、花香、柑橘、木質調但不久之後的後味是高級又溫和的皮革味，淵源留長，冷氣房噴脖子一下持香度長約6小時以上，正所謂低調中的奢華享受大概就是這樣吧！,木質花香調 、 皮革香調,檀木香、雪松、檸檬醛,忍冬、山楂,乳香、蘇合、皮革,https://www.1976.com.tw/prod/2588
Versace Eros 凡賽斯艾諾斯愛神男性淡香水,"2,000","1,080",30ml,這支在外國被公認是最好的夜店香，滿滿的果香，持久度更是驚人，即使是濃度最低的淡香水，仍可持續8小時以上。,柑苔調,薄荷、檸檬、青蘋果,零陵香豆、天竺葵、龍涎香、香草,香草、香根草、橡樹苔、雪松,https://www.1976.com.tw/prod/11018
Guerlain L'homme Ideal 男性淡香精版本,"5,020","3,650",100ml,以一個進乎美食調的前調做為開場，像是個撒上檸檬皮細末的香甜櫻桃派，一小段時間後，皮革的味道出來，但那個貫穿Ideal系列的奶香杏仁味依舊存在，配上背景的焚香以及辛香料，造就了帶有東方調性的柔和甜美皮革，非常的誘人,東方花香調 、 皮革香調,香檸檬、辛香料、杏仁、百里香、薰衣草、迷迭香,土耳其玫瑰、焚香、香草、櫻桃,檀木、皮革、零陵香豆,https://www.1976.com.tw/prod/16268
Gucci Guilty 罪愛男性淡香精版本,"5,200","3,120",90ml,很少有男性香水會有這麼清晰明顯的花香，但它的花香又不像女香那樣，很清新，很適合花美男型的男生噴，氣質會大大加分!,木質調 、 辛辣調,玫瑰、香醋、紅辣椒、鹽,橙花純油、橙花、法國薰衣草,雪松、廣藿香,https://www.1976.com.tw/prod/19210
Mr Burberry 男性淡香水,"3,200","1,450",50ml,微微辛辣帶點清新的前調，適合在辦公室裡的白領階級穿上，沉穩的木質調更提升可靠的形象。,木質調,葡萄柚、香艾菊、白豆蔻,樺木葉、肉豆蔻油、雪松,香根草、癒創木、檀香木,https://www.1976.com.tw/prod/14042
Montblanc Explorer Ultra Blue 萬寶龍探尋藍海男性淡香精,"2,150",960,30ml,非常喜歡男生噴這瓶，柑橘清爽調，後味的皮革帶出的韻味成熟而值得依靠的感覺，人家說味道具有記憶，我都會想起約會時男生的味道，久久不能忘懷。,柑橘調 、 海洋清新調 、 皮革香調,檸檬、佛手柑、 粉紅胡椒,海洋基調 、紫羅蘭葉、 龍涎香,廣藿香、東加豆、皮革,https://www.1976.com.tw/prod/19191
Dior Fahrenheit 迪奧華氏溫度男性淡香水 TESTER,"4,450","3,050",100ml 原廠環保紙盒包裝，有瓶蓋,宛如瓶身的橘紅漸層色調，讓人是一種逐漸升溫的香調，前味的木質調雖然並不讓人馬上記憶，後續蘊含了非常有層次的類似花香的蜂蜜味和檀木香調，成熟卻感到熱情的一款。,木質花香調,檀木香、雪松、檸檬醛,忍冬、山楂,乳香、蘇合、皮革,https://www.1976.com.tw/prod/13181
Versace Eros 凡賽斯艾諾斯愛神男性淡香水 TESTER,"3,350","1,580",100ml 原廠環保紙盒包裝，有瓶蓋,有別於標準男香的調性，前味的甜讓人想到橘身的miss dior，那種年輕遊樂園的甜糖味。後調性感勾人，有放肆的作風！香水一發行時我人在泰國機場，一路到台灣我都還不確定要不要買，每次見到每次試聞，在101聞最後一次後我就帶回家了。厲害的瓶身是一大賣點，不想撞香的可以去試看看！,柑苔調,薄荷、檸檬、青蘋果,零陵香豆、天竺葵、龍涎香、香草,香草、香根草、橡樹苔、雪松,https://www.1976.com.tw/prod/15524
Montblanc Explorer Ultra Blue 萬寶龍探尋藍海男性淡香精 TESTER,"3,900","1,299",100ml 原廠環保紙盒包裝，有瓶蓋,這款叫探尋藍海，但跟探尋旅者差很多，海洋味很明顯，感覺就是個陽光大男孩，也有點像一般男性沐浴乳的味道，皮革味道也比較淡，雖然是香精版，但真的蠻淡的；第一次使用相較之下會比較喜歡探尋旅者多一點，但不知道為什麼回到家後忍不住一直聞自己身上隱約的味道。,柑橘調 、 海洋清新調,檸檬、佛手柑、 粉紅胡椒,海洋基調 、紫羅蘭葉、 龍涎香,廣藿香、東加豆、皮革,https://www.1976.com.tw/prod/19228
Boss No1 經典一號男性淡香水,"3,800","1,750",100ml,知名品牌BOSS的第一款男香，上市超過35年的經典香氛！,柑苔調,艾蒿、杜松、香檸檬、檸檬、青蘋果、香芹籽、羅勒、葡萄柚,蜂蜜、薰衣草、玫瑰、茉莉、鼠尾草、天竺葵、鈴蘭、鳶尾根,煙草、橡苔、廣藿香、檀木、麝香、琥珀、肉桂、雪松,https://www.1976.com.tw/prod/3452
Carolina Herrera 212 SEXY MEN 男性淡香水,"3,300","2,480",100ml,之前幫朋友挑了一罐212，朋友非常喜歡，後來看到212有出新版本，基於好奇心就試了一下，有別於212，這瓶相對比較野性，也有勾人的性感，感覺很讚,木質東方調,柑橘、佛手柑、綠葉,小荳蔻、花瓣、胡椒,檀香、香草、癒瘡木、麝香、琥珀,https://www.1976.com.tw/prod/4877
Salvatore Ferragamo UOMO Signature 峰度男性淡香精,"3,650","1,650",100ml,UOMO 系列的第三部曲- UOMO Signature 峰度男性淡香精，讓人聯想起佛羅倫斯傳統的皮革，也帶來了一種由咖啡的醇厚和黑香豆交織延伸出的新性感基調。,東方調 、 皮革香調,葡萄柚、柑桔精華、 粉紅胡椒,柏樹、荳蔻、肉桂,黑香豆、咖啡、廣藿 香、皮革,https://www.1976.com.tw/prod/17741
Dolce & Gabbana Devotion 摯愛男性淡香精,"3,800","2,280",50ml,Dolce & Gabbana Devotion 摯愛男性淡香精散發著木質辛香氣息，是一款迷人、口感細膩的香水，這款香水是由 Olivier Cresp 為 Dolce&Gabbana 專門調製的，以檸檬的新鮮和熱情開始，核心是咖啡辛辣和令人振奮的本質，廣藿香的泥土氣息賦予了特色和深度。,誘人美食調,檸檬,咖啡,廣藿香,https://www.1976.com.tw/prod/22851
Dolce & Gabbana Devotion 摯愛男性淡香精 TESTER,"4,800","2,250",100ml 原廠環保紙盒包裝，有瓶蓋,Dolce & Gabbana Devotion 摯愛男性淡香精散發著木質辛香氣息，是一款迷人、口感細膩的香水，這款香水是由 Olivier Cresp 為 Dolce&Gabbana 專門調製的，以檸檬的新鮮和熱情開始，核心是咖啡辛辣和令人振奮的本質，廣藿香的泥土氣息賦予了特色和深度。,誘人美食調,檸檬,咖啡,廣藿香,https://www.1976.com.tw/prod/23004
Versace EROS 艾諾斯愛神男性淡香水迷你瓶,450,240,5ml,剛抹上的氣味非常的馥郁，但因為氣味非常平衡所以反而令人很是驚艷，中後味會聯想到古代仕女的脂粉香氣卻不會過甜，是現在很少見不會過分甜膩的一品香水，感覺像是溫潤的琥珀，有著沉靜、熟悉又神秘的強烈存在感。,柑苔調,薄荷、檸檬、青蘋果,零陵香豆、天竺葵、龍涎香、香草,香草、香根草、橡樹苔、雪松,https://www.1976.com.tw/prod/11019
Giorgio Armani Acqua di Gio 亞曼尼寄情水男性淡香精版本隨身香氛,"1,600",799,15ml 噴式,超好聞的 香味又持久!!瓶身設計又簡單俐落!!好適合夏天阿，開心!!!,礦物香調、香根草、廣藿香,海洋調、青柑橘,快樂鼠尾草、天竺葵、薰衣草,,https://www.1976.com.tw/prod/22633
Boss In Motion 新動感男性淡香水(2022),"3,800","1,520",100ml,運動氣息的香味，很適合年輕族群及喜愛運動的人使用!! 後味留下來的沉穩氣味，可以反映有衝勁的男性朋友另外一種個性!值得推薦!!,東方清新調,羅勒、佛手柑、柑橘、紫羅蘭葉,白豆蔻、胡椒、肉桂、肉豆蔻,檀木、麝香、香根草,https://www.1976.com.tw/prod/19272
Dunhill Moroccan Amber 頂級香氛 摩洛哥琥珀男性淡香精,"5,500","2,121",100ml,瓶身設計及外包裝都非常有質感，味道也意外地非常舒服，頂級香氛果然不凡!,木質東方調 、 辛辣調,黑胡椒、香菜、荳蔻、生薑,番紅花、臘菊、肉豆蔻,沉香、摩洛哥皮革、咖啡木、琥珀,https://www.1976.com.tw/prod/19563
Gucci Guilty Elixir de Parfum 罪愛男性香精,"5,650","3,550",60ml,以珍貴的廣藿香為主調，並加強濃度，使香氣更加強烈。香草醛萃取物的添加提升原始香氣，高貴的鳶尾脂則賦予了溫暖環繞的香氣。令人愉悅的龍涎香琥珀香調和淡淡的肉豆蔻氣息相輔相成，使香氣達到巔峰。最後，安息香的基調賦予香氣深度和吸引力。,木質東方調,鳶尾花,龍涎香,安息香,https://www.1976.com.tw/prod/22549
Montblanc Explorer Platinum 萬寶龍極限探尋男性淡香精,"2,150",980,30ml,非常喜歡男生噴這瓶，清爽木質調，後味的雪松帶出值得依靠的感覺，人家說味道具有記憶，久久不能忘懷。,草香清新調 、 木質清新調,紫羅蘭葉,鼠尾草,雪松,https://www.1976.com.tw/prod/20990
Dolce & Gabbana Devotion 摯愛男性淡香精迷你瓶,800,480,5ml 抹式,Dolce & Gabbana Devotion 摯愛男性淡香精散發著木質辛香氣息，是一款迷人、口感細膩的香水，這款香水是由 Olivier Cresp 為 Dolce&Gabbana 專門調製的，以檸檬的新鮮和熱情開始，核心是咖啡辛辣和令人振奮的本質，廣藿香的泥土氣息賦予了特色和深度。,誘人美食調,檸檬,咖啡,廣藿香,https://www.1976.com.tw/prod/23102
Gucci Guilty Black 罪愛夜男性淡香水,"3,150","1,750",50ml,我的第一支香水，讓我身上多了柔美的花香搭配著成熟的氣息，彷彿來到一座心曠神怡的花園中，會讓人忍不住就探索你的祕密花園，如同名稱罪愛夜使人有無限想像。,木質花香調,芫荽、薰衣草,橙花、橙花精油、嫩綠芳香,廣藿香、雪松木,https://www.1976.com.tw/prod/11128
Dior Fahrenheit Parfum 迪奧華氏溫度男性香精,"5,650","3,950",75ml,這款香水就像瓶身的設計與名字，昇華的溫暖東方皮革調，成熟穩重。干燥的波本香草夾雜了朗姆酒，很男人的味道!適合秋冬季節使用。,東方調 、 皮革香調,絨面革、甘草、西西里柑橘,紫羅蘭葉、朗姆酒、香菜、小茴香,波本香草,https://www.1976.com.tw/prod/21080
Guerlain Vetiver 嬌蘭香根草男性淡香水,"4,500","2,880",100ml 外盒略有瑕疵,煙燻香根草，從開始到結束香根草都非常明顯，嬌蘭良心優品，十分驚艷。,草香清新調 、 木質花香調 、 柑橘調,肉荳蔻核仁、香菜、橘子、奈若利橙花、佛手柑、煙草、檸檬,康乃馨、檀木、胡椒、鳶尾根、鼠尾草、香根草,皮革、零陵香豆、琥珀、果子狸、橡苔、香根草、沒藥,https://www.1976.com.tw/prod/14962
Mr Burberry 男性淡香精版本,"5,300","2,650",100ml,"非常清香淡雅的木質調一點都不老氣,前中味帶點甜膩的花香味非常好聞,中後味是溫暖的木質香調,而且香味非常持久適合輕熟男秋冬季節",木質調,香艾菊、肉桂,廣藿香、薰衣草,琥珀、香根草,https://www.1976.com.tw/prod/15783
Giorgio Armani Acqua di Gio 亞曼尼寄情水男性香精版本 PARFUM,"3,600","2,550",50ml,"真的好聞~
前味開頭很突出，很明顯但不打擾人的海洋調！
大概半小時後就轉為淡淡的、要靠近皮膚才會聞到味道，好聞且令人上癮。",木質調 、 海洋清新調,海洋調、佛手柑,快樂鼠尾草、天竺葵、迷迭香,廣藿香、乳香,https://www.1976.com.tw/prod/21644
Salvatore Ferragamo UOMO 峰範男性淡香水,"3,650","1,650",100ml,提拉米蘇! 提拉米蘇! 提拉米蘇! 一噴下去就是滿滿的提拉米蘇味道。因為沒有嘗試過美食調的香水，試聞後就決定入手。調性上感覺跟百萬富翁有點相似，甜中帶有穩重感。也非常適合睡前噴，但前提是餓肚子的狀態下可能會有反效果，一直想吃東西這樣~,木質東方調 、 誘人美食調,黑胡椒、佛手柑、荳蔻,提拉米蘇、橙花、龍涎香,喀什米爾木、檀香、黑豆香,https://www.1976.com.tw/prod/15104
Versace EROS 艾諾斯愛神男性淡香精版本,"2,850","1,450",50ml,凡賽斯最豐富多彩的一款，香甜不膩揉合了香草與香根草，佐以龍涎香穩住男性調，這就是最受國外歡迎的愛神Eros! 如果你又是位有點身材，乾乾淨淨的男性，把愛神噴在結實的手臂上，你就要小心了！被思春期的女生聞到的話，可能被狠咬你一口！德國網紅帥哥Jeremy最愛的夜場男香！,木質東方調,薄荷、義大利檸檬、蘋果、義大利柑橘,玫瑰天竺葵、快樂鼠尾草、龍涎香,香草、香根草、大西洋雪松、廣藿香、檀香,https://www.1976.com.tw/prod/18597
Versace EROS 艾諾斯愛神男性淡香精版本 TESTER,"3,700","1,780",100ml 原廠環保紙盒包裝，有瓶蓋,全新的艾諾斯‧愛神男性淡香精是為那些熱情又英勇，擁有希臘愛神般性格的男人們量身打造；它的香味深刻地刻畫出屬於男人的性感與無窮的力量。,木質東方調,薄荷、義大利檸檬、蘋果、義大利柑橘,玫瑰天竺葵、快樂鼠尾草、龍涎香,香草、香根草、大西洋雪松、廣藿香、檀香,https://www.1976.com.tw/prod/19304
Montblanc Explorer Platinum 萬寶龍極限探尋男性淡香精 TESTER,"3,900","1,380",100ml 原廠環保紙盒包裝，有瓶蓋,非常喜歡男生噴這瓶，清爽木質調，後味的雪松帶出值得依靠的感覺，人家說味道具有記憶，久久不能忘懷。,草香清新調 、 木質清新調,紫羅蘭葉,鼠尾草,雪松,https://www.1976.com.tw/prod/20993
Dior Fahrenheit Parfum 迪奧華氏溫度男性香精 TESTER,"5,650","3,450",75ml 原廠環保紙盒包裝，有瓶蓋,這款香水就像瓶身的設計與名字，昇華的溫暖東方皮革調，成熟穩重。干燥的波本香草夾雜了朗姆酒，很男人的味道!適合秋冬季節使用。,東方調 、 皮革香調,絨面革、甘草、西西里柑橘,紫羅蘭葉、朗姆酒、香菜、小茴香,波本香草,https://www.1976.com.tw/prod/21516
Gucci Guilty Black 罪愛夜男性淡香水 TESTER,"4,500","2,100",90ml (絕版)原廠環保紙盒包裝，有瓶蓋,這款我有買過，我很喜歡這味道，一開始噴味道會重一點，但之後到中味香氣很迷人，連我走在路上去買東西店員是女生還問我說這是甚麼品牌，她很喜歡。,木質東方調,芫荽、薰衣草,橙花、橙花精油、嫩綠芳香,廣藿香、雪松木,https://www.1976.com.tw/prod/10808
Dunhill Arabian Deser 頂級香氛 阿拉伯沉香木男性淡香精,"5,500","2,299",100ml,一開出聞到一股淡淡又溫暖不刺鼻的木質味，過了2小時隨著時間轉變，我聞到的是一股熟男奶香味，有別於Narciso香精版的花香奶味，這款更適合30以上的熟男使用，持香時間有8小時以上，噴在衣服胸口上，從上班到下班都還能一直聞到:D,木質東方調 、 東方花香調,藏紅花、玫瑰花和佛柑,玫瑰、茉莉,沉香、琥珀、焚香,https://www.1976.com.tw/prod/20241
Montblanc Explorer Platinum 萬寶龍極限探尋男性淡香精迷你瓶,600,260,4.5ml 抹式(銀盒),非常喜歡男生噴這瓶，清爽木質調，後味的雪松帶出值得依靠的感覺，人家說味道具有記憶，久久不能忘懷。,草香清新調 、 木質清新調,紫羅蘭葉,鼠尾草,雪松,https://www.1976.com.tw/prod/20992
Versace Eros 凡賽斯艾諾斯愛神男性香精 Parfum,"4,350","2,880",100ml,凡賽斯最豐富多彩的一款，香甜不膩揉合了香草與香根草，佐以龍涎香穩住男性調，這就是最受國外歡迎的愛神Eros! 如果你又是位有點身材，乾乾淨淨的男性，把愛神噴在結實的手臂上，你就要小心了！被思春期的女生聞到的話，可能被狠咬你一口！德國網紅帥哥Jeremy最愛的夜場男香！,東方調,義大利檸檬、義大利柑橘、山蒼樹、黑胡椒,埃及天竺葵、薰衣草、快樂鼠尾草,安息香、廣藿香、香草、海地香根草,https://www.1976.com.tw/prod/20565
